categoria,nombre,precio,precio_transferencia,descripcion,variantes,url
"" ,"","Precio sin impuestos
                            : $0,00","$10.100,00 Precio sin impuestos $8.347,11 $9.595,00 con Transferencia o depósito bancario 💰","¡¡¡NUEVA PRESENTACION 3KG!!! Jaspe Adultos es un alimento equilibrado para perros en etapa adulta. Brinda los nutrientes necesarios para mantener su vitalidad y salud intestinal, con ingredientes sele","","https://lamascoteranoa.com.ar/productos/jaspe-adulto-rm-g-x-3-kg-qmuky/"
"" ,"ACA NO AEROSOL X 419 ML.","Precio sin impuestos
                            : $0,00","$17.300,00 Precio sin impuestos $14.297,52 $16.435,00 con Transferencia o depósito bancario 💰","Acá No® Interiores Auxiliar educativo para interiores en aerosol. Acá No® Interiores ahuyenta perros y gatos de muebles, tapizados, alfombras, autos, etc. Una aplicación de Acá No® Interiores actúa du","","https://lamascoteranoa.com.ar/productos/aca-no-aerosol-x-419-ml1/"
"" ,"ACÁ NO Liquido x 1 Lts","Precio sin impuestos
                            : $0,00","$22.700,00 Precio sin impuestos $18.760,33 $21.565,00 con Transferencia o depósito bancario 💰","Modificador de la conducta de perros y gatos. Líquido diluible para proteger grandes superficies. ACÁ NO® Líquido ayuda a repeler a perros y gatos de lugares amplios que se desean proteger como patios","","https://lamascoteranoa.com.ar/productos/aca-no-liquido-x-1-lts/"
"" ,"ACÁ NO Liquido x 450 ml","Precio sin impuestos
                            : $0,00","$14.900,00 Precio sin impuestos $12.314,05 $14.155,00 con Transferencia o depósito bancario 💰","Modificador de la conducta de perros y gatos. Líquido diluible para proteger grandes superficies. ACÁ NO ® Líquido ayuda a repeler a perros y gatos de lugares amplios que se desean proteger como patio","","https://lamascoteranoa.com.ar/productos/aca-no-liquido-x-450-ml/"
"" ,"AGILITY AD SALMON X 10 KGS","Precio sin impuestos
                            : $0,00","$68.800,00 Precio sin impuestos $56.859,50 $65.360,00 con Transferencia o depósito bancario 💰","El bienestar interno de los gatos se manifiesta en su vigor exterior. Agility+ es la nutrición de avanzada que supera los requerimientos nutricionales del gato adulto. Combina la excelencia de la prot","","https://lamascoteranoa.com.ar/productos/agility-ad-salmon-x-10-kgs/"
"" ,"AGILITY ADULTO PLUS CORDERO X 1,5 KGS","Precio sin impuestos
                            : $0,00","$10.800,00 Precio sin impuestos $8.925,62 $10.260,00 con Transferencia o depósito bancario 💰","AGILITY+ DOG ADULT CORDERO es nutrición de avanzada. Combina la excelencia de la proteína del cordero, con nutrientes específicamente integrados para potenciar su salud, con un plus bifuncional: contr","","https://lamascoteranoa.com.ar/productos/agility-adulto-plus-cordero-x-15-kgs/"
"" ,"AGILITY ADULTO PLUS CORDERO X 15 KGS","Precio sin impuestos
                            : $0,00","$75.800,00 Precio sin impuestos $62.644,63 $72.010,00 con Transferencia o depósito bancario 💰","AGILITY+ DOG ADULT CORDERO es nutrición de avanzada. Combina la excelencia de la proteína del cordero, con nutrientes específicamente integrados para potenciar su salud, con un plus bifuncional: contr","","https://lamascoteranoa.com.ar/productos/agility-adulto-plus-cordero-x-15-kgs1/"
"" ,"AGILITY ADULTOS TALLA PEQUEÑA X 1.5KG.","Precio sin impuestos
                            : $0,00","$9.400,00 Precio sin impuestos $7.768,60 $8.930,00 con Transferencia o depósito bancario 💰","Los perros adultos de estructura pequeña necesitan una alimentación con un alto aporte de proteínas y grasas para mantener una salud integral óptima. Agility Adultos Razas Pequeñas es una fórmula espe","","https://lamascoteranoa.com.ar/productos/agility-adultos-talla-pequena-x-1-5kg/"
"" ,"AGILITY ADULTOS TALLA PEQUEÑA X 3 KG.","Precio sin impuestos
                            : $0,00","$46.600,00 Precio sin impuestos $38.512,40 $44.270,00 con Transferencia o depósito bancario 💰","Agility Adultos Razas Pequeñas es una fórmula especialmente ideada para promover óptimos niveles de energía y vitalidad, basada en su tecnología Healthy Complex: una combinación de nutrientes minucios","","https://lamascoteranoa.com.ar/productos/agility-adultos-talla-pequena-x-3-kg/"
"" ,"AGILITY CATS CONTROL DE PESO X 1,5 KG.","Precio sin impuestos
                            : $0,00","$15.600,00 Precio sin impuestos $12.892,56 $14.820,00 con Transferencia o depósito bancario 💰","Alimento balanceado completo, cocido por extrusión, resultado de una mezcla equilibrada de macronutrientes, micronutrientes y aditivos de altísima calidad que cubren los requerimientos alimenticios de","","https://lamascoteranoa.com.ar/productos/agility-cats-control-de-peso-x-15-kg/"
"" ,"AGILITY DOG CACHORRO X 340 GR. EO","Precio sin impuestos
                            : $0,00","$4.700,00 Precio sin impuestos $3.884,30 $4.465,00 con Transferencia o depósito bancario 💰","Alimento balanceado completo húmedo, cocido al vapor, resultado de una mezcla equilibrada de macronutrientes, micronutrientes y aditivos de la más alta calidad que cubren los requerimientos alimentici","","https://lamascoteranoa.com.ar/productos/agility-dog-cachorro-x-340-gr-eo/"
"" ,"AGILITY DOG CERDO X 340 GR. EO","Precio sin impuestos
                            : $0,00","$4.500,00 Precio sin impuestos $3.719,01 $4.275,00 con Transferencia o depósito bancario 💰","Alimento balanceado completo húmedo, cocido al vapor, resultado de una mezcla equilibrada de macronutrientes, micronutrientes y aditivos de la más alta calidad que cubren los requerimientos alimentici","","https://lamascoteranoa.com.ar/productos/agility-dog-cerdo-x-340-gr-eo/"
"" ,"AGILITY GATOS STRONG HEART SALMON X 340 GR","Precio sin impuestos
                            : $0,00","$5.200,00 Precio sin impuestos $4.297,52 $4.940,00 con Transferencia o depósito bancario 💰","El bienestar interno de los gatos se manifiesta en su vigor exterior. Agility+ es la nutrición de avanzada que supera los requerimientos nutricionales del gato adulto. Combina la excelencia de la prot","","https://lamascoteranoa.com.ar/productos/agility-strong-heart-salmon-x-340-gr/"
"" ,"ALICATE CON LIMA P+","Precio sin impuestos
                            : $0,00","$8.200,00 Precio sin impuestos $6.776,86 $7.790,00 con Transferencia o depósito bancario 💰","Mantené las uñas de tu mascota prolijas y saludables con este alicate para corte de uñas , diseñado para un uso cómodo y seguro en perros y gatos. Su hoja de acero inoxidable permite un corte limpio y","","https://lamascoteranoa.com.ar/productos/alicate-con-lima-p-4dod3/"
"" ,"ARNES CON MANIJA PERRO P+","Precio sin impuestos
                            : $0,00","$16.900,00 Precio sin impuestos $13.966,94 $16.055,00 con Transferencia o depósito bancario 💰","Comodidad, control y estilo en un solo accesorio. Este arnés con manija superior integrada te permite sujetar fácilmente a tu perro cuando necesitás un mayor control, ya sea para cruzar calles, subir ","","https://lamascoteranoa.com.ar/productos/arnes-con-manija-perro-p/"
"" ,"ARNES PERRO CON CORREA P+","Precio sin impuestos
                            : $0,00","$12.200,00 Precio sin impuestos $10.082,64 $11.590,00 con Transferencia o depósito bancario 💰","Ofrecéle a tu perro mayor confort y seguridad en cada paseo con este arnés tipo chaleco . Confeccionado en material respirable y acolchado , distribuye la presión de forma uniforme, evitando tirones e","","https://lamascoteranoa.com.ar/productos/arnes-perro-con-correa-p-6rl8w/"
"" ,"ARO SUPREME ANTIESTRES","Precio sin impuestos
                            : $0,00","$110.400,00 Precio sin impuestos $91.239,67 $104.880,00 con Transferencia o depósito bancario 💰","Tamaños disponibles: CHICO: 42 CM MEDIANO: 52 CM GRANDE: 62 CM","","https://lamascoteranoa.com.ar/productos/aro-supreme-antiestres/"
"" ,"ASADITOS CACHORRO X 40 GR","Precio sin impuestos
                            : $0,00","$2.100,00 Precio sin impuestos $1.735,54 $1.995,00 con Transferencia o depósito bancario 💰","Golosina snack Asaditos lomitos de carne con leche para perros cachorros . Cada paquete contiene 6 unidades. 28% de proteína. Elaborado con cortes de carne fresca y una selección de ingredientes de al","","https://lamascoteranoa.com.ar/productos/asaditos-cachorro-x-40-gr/"
"" ,"ASADITOS GATO X 40 GR","Precio sin impuestos
                            : $0,00","$1.900,00 Precio sin impuestos $1.570,25 $1.805,00 con Transferencia o depósito bancario 💰","PROMOCIONES NO ACUMULABLES CON OTROS DESCUENTOS Asaditos Snack Premium para gatos 40g Nuestros lomitos de carne y pescado son únicos, porque están hechos con carne fresca, sin conservantes ni colorant","","https://lamascoteranoa.com.ar/productos/asaditos-gato-x-40-gr/"
"" ,"Absorsol Perfumadas x 2 kg. Piedras Sanitarias","Precio sin impuestos
                            : $0,00","$4.300,00 Precio sin impuestos $3.553,72 $4.085,00 con Transferencia o depósito bancario 💰","Las piedras sanitarias Alta Gama Perfumadas para gatos brindan máximo rendimiento. Son ecológicas y reciclables, quitan los olores de los excrementos, absorben la cantidad de líquido equivalente a su ","","https://lamascoteranoa.com.ar/productos/alta-gama-x-2-kg-piedras-sanitarias/"
"" ,"Absorsol x 3.6 kg. Piedras Sanitarias","Precio sin impuestos
                            : $0,00","$5.300,00 Precio sin impuestos $4.380,17 $5.035,00 con Transferencia o depósito bancario 💰","Arena sanitaria para gatos Absorsol.","","https://lamascoteranoa.com.ar/productos/absorsol-x-3-6-kg-piedras-sanitarias/"
"" ,"Aceite Lubricante Andis","Precio sin impuestos
                            : $0,00","$8.300,00 Precio sin impuestos $6.859,50 $7.885,00 con Transferencia o depósito bancario 💰","CONSULTA STOCK AQUI ACEITE LUBRICANTE PARA CUCHILLAS ANDIS® CLIPPER OIL • Fórmula incolora e inodora • Fórmula desarrollada para optimizar el rendimiento de corte de la cuchilla. • No tiene color ni o","","https://lamascoteranoa.com.ar/productos/aceite-lubricante-andis/"
"" ,"Acondicionador Osspret Extra Brillo Groomers","Precio sin impuestos
                            : $0,00","$6.600,00 Precio sin impuestos $5.454,55 $6.270,00 con Transferencia o depósito bancario 💰","Acción Acondicionador de pelo, desenredante. Descripción Rico en agentes grasos esenciales: aceites de almendras y de jojoba con propiedades nutritivas. Restructurante. Regenerador de la fibra capilar","","https://lamascoteranoa.com.ar/productos/acondicionador-osspret-extra-brillo-groomers/"
"" ,"Aerosol Andis 5 En 1 x 440 grs.","Precio sin impuestos
                            : $0,00","$30.700,00 Precio sin impuestos $25.371,90 $29.165,00 con Transferencia o depósito bancario 💰","AEROSOL PROFESIONAL MARCA ANDIS 5 EN 1 DESINFECTANTE + LUBRICANTE + REFRIGERANTE + LIMPIADOR + PREVIENE EL OXIDO PARA CUCHILLAS DE CORTADORAS OSTER MOSER, WAHL, ANDIS, GTS OVEJA NEGRA, ETC Contra Viru","","https://lamascoteranoa.com.ar/productos/aerosol-andis-5-en-1-x-440-grs/"
"" ,"Aerosol BABS x 250 ml.","Precio sin impuestos
                            : $0,00","$12.700,00 Precio sin impuestos $10.495,87 $12.065,00 con Transferencia o depósito bancario 💰","Aerosol antiparasitario externo para caninos de acción prolongada. PULGUICIDA Y GARRAPATICIDA EN AEROSOL BABS® es un eficaz antiparasitario externo con un práctico sistema en aerosol de aplicación que","","https://lamascoteranoa.com.ar/productos/aerosol-babs-x-250-ml/"
"" ,"Agility Adulto Raza Pequeña x 15kg","Precio sin impuestos
                            : $0,00","$66.000,00 Precio sin impuestos $54.545,45 $62.700,00 con Transferencia o depósito bancario 💰","DESCRIPCION Alimento balanceado seco para perros adultos de razas pequeñas, Caracteristicas: Los perros adultos de estructura pequeña necesitan una alimentación con un alto aporte de proteínas y grasa","","https://lamascoteranoa.com.ar/productos/agility-adulto-raza-pequena-x-15kg/"
"" ,"Agility Gatito x 1.5 kg","Precio sin impuestos
                            : $0,00","$14.900,00 Precio sin impuestos $12.314,05 $14.155,00 con Transferencia o depósito bancario 💰","Alimento balanceado completo, cocido por extrusión, resultado de una mezcla equilibrada de macronutrientes, micronutrientes y aditivos de altísima calidad que cubren los requerimientos alimenticios de","","https://lamascoteranoa.com.ar/productos/agility-gatito-x-1-5-kg/"
"" ,"Agility Gatito x 10 kg.","Precio sin impuestos
                            : $0,00","$74.800,00 Precio sin impuestos $61.818,18 $71.060,00 con Transferencia o depósito bancario 💰","Alimento balanceado completo, cocido por extrusión, resultado de una mezcla equilibrada de macronutrientes, micronutrientes y aditivos de altísima calidad que cubren los requerimientos alimenticios de","","https://lamascoteranoa.com.ar/productos/agility-gatito-x-10-kg/"
"" ,"Agility Gato Adulto x 1.5 kg","Precio sin impuestos
                            : $0,00","$13.700,00 Precio sin impuestos $11.322,31 $13.015,00 con Transferencia o depósito bancario 💰","Alimento balanceado completo, cocido por extrusión, resultado de una mezcla equilibrada de macronutrientes, micronutrientes y aditivos de altísima calidad que cubren los requerimientos alimenticios de","","https://lamascoteranoa.com.ar/productos/agility-gato-adulto-x-1-5-kg/"
"" ,"Agility Gato Adulto x 10 kg","Precio sin impuestos
                            : $0,00","$69.100,00 Precio sin impuestos $57.107,44 $65.645,00 con Transferencia o depósito bancario 💰","Alimento balanceado completo, cocido por extrusión, resultado de una mezcla equilibrada de macronutrientes, micronutrientes y aditivos de altísima calidad que cubren los requerimientos alimenticios de","","https://lamascoteranoa.com.ar/productos/agility-gato-adulto-x-10-kg/"
"" ,"Agility Gato Control de Peso x 10 kg.","Precio sin impuestos
                            : $0,00","$78.200,00 Precio sin impuestos $64.628,10 $74.290,00 con Transferencia o depósito bancario 💰","Alimento balanceado y 100% completo para gatos adultos a partir de los 12 meses con menor actividad, tendencia o que tienen sobrepeso. Su fórmula aporta la cantidad de macronutrientes y micronutriente","","https://lamascoteranoa.com.ar/productos/agility-gato-control-de-peso-x-10-kg/"
"" ,"Agility Gato Urinario x 1.5 kg","Precio sin impuestos
                            : $0,00","$15.200,00 Precio sin impuestos $12.561,98 $14.440,00 con Transferencia o depósito bancario 💰","Los gatos adultos con tendencia a alteraciones urinarias necesitan de una alimentación completa y equilibrada que cubra sus requerimientos nutricionales y les brinde salud y vitalidad. Agility Cats Ur","","https://lamascoteranoa.com.ar/productos/agility-gato-urinario-x-1-5-kg/"
"" ,"Agility Gato Urinario x 10 kg","Precio sin impuestos
                            : $0,00","$74.800,00 Precio sin impuestos $61.818,18 $71.060,00 con Transferencia o depósito bancario 💰","Los gatos adultos con tendencia a alteraciones urinarias necesitan de una alimentación completa y equilibrada que cubra sus requerimientos nutricionales y les brinde salud y vitalidad. Agility Cats Ur","","https://lamascoteranoa.com.ar/productos/agility-gato-urinario-x-10-kg/"
"" ,"Agility Perro Adulto x 20 kg.","Precio sin impuestos
                            : $0,00","$72.500,00 Precio sin impuestos $59.917,36 $68.875,00 con Transferencia o depósito bancario 💰","Alimento balanceado seco para perros de talla mediana o grande en etapa adulta. Caracteristicas: Formulado con acidos grasos que ayudan a mejorar la salud de la piel y el pelo. Posee fibras naturales ","","https://lamascoteranoa.com.ar/productos/agility-perro-adulto-x-20-kg/"
"" ,"Agility Perro Adulto x 3 kg.","Precio sin impuestos
                            : $0,00","$15.300,00 Precio sin impuestos $12.644,63 $14.535,00 con Transferencia o depósito bancario 💰","Alimento balanceado seco para perros de talla mediana o grande en etapa adulta. Caracteristicas: Formulado con acidos grasos que ayudan a mejorar la salud de la piel y el pelo. Posee fibras naturales ","","https://lamascoteranoa.com.ar/productos/agility-perro-adulto-x-3-kg/"
"" ,"Agility Perro Cachorro x 20 kg.","Precio sin impuestos
                            : $0,00","$83.700,00 Precio sin impuestos $69.173,55 $79.515,00 con Transferencia o depósito bancario 💰","Alimento balanceado seco para perros en etapa de cachorros de tamaño mediano o grande desde los 2 meses hasta el año de edad. Caracteristicas: Durante el primer año de vida es fundamental que el cacho","","https://lamascoteranoa.com.ar/productos/agility-perro-cachorro-x-15-kg/"
"" ,"Agility Perro Cachorro x 3 kg.","Precio sin impuestos
                            : $0,00","$17.500,00 Precio sin impuestos $14.462,81 $16.625,00 con Transferencia o depósito bancario 💰","Alimento balanceado seco para perros en etapa de cachorros de tamaño mediano o grande desde los 2 meses hasta el año de edad. Caracteristicas: Durante el primer año de vida es fundamental que el cacho","","https://lamascoteranoa.com.ar/productos/agility-perro-cachorro-x-3-kg/"
"" ,"Agility Perro Derma Control x 3 kg.","Precio sin impuestos
                            : $0,00","$17.300,00 Precio sin impuestos $14.297,52 $16.435,00 con Transferencia o depósito bancario 💰","Alimento balanceado seco para perros con problemas dermacologicos. Caracteristicas : Agility Adultos Derma Control es un alimento especialmente formulado con proteína de cerdo, que por su baja alergen","","https://lamascoteranoa.com.ar/productos/agility-perro-derma-control-x-3-kg/"
"" ,"Alicate Comun Nª 1","Precio sin impuestos
                            : $0,00","$6.800,00 Precio sin impuestos $5.619,83 $6.460,00 con Transferencia o depósito bancario 💰","CEPILLO DOBLE $0,00 $6.000,00 $5.700,00 con Transferencia o depósito bancario 💰","","https://lamascoteranoa.com.ar/productos/alicate-comun-n-1/"
"" ,"Alicate Común Nª 2","Precio sin impuestos
                            : $0,00","$8.800,00 Precio sin impuestos $7.272,73 $8.360,00 con Transferencia o depósito bancario 💰","CEPILLO DOBLE $0,00 $6.000,00 $5.700,00 con Transferencia o depósito bancario 💰","","https://lamascoteranoa.com.ar/productos/alicate-comun-n-2/"
"" ,"Alimento Shulet Peces x 10 gr.","Precio sin impuestos
                            : $0,00","$3.500,00 Precio sin impuestos $2.892,56 $3.325,00 con Transferencia o depósito bancario 💰","Alimento balanceado para peces en forma de escamas que es altamente palatable, tiene máxima digestibilidad, cuenta con todos los nutrientes necesarios y además, cuenta con la ventaja de que no enturbi","","https://lamascoteranoa.com.ar/productos/alimento-shulet-peces-x-10-gr/"
"" ,"Alimento Shulet Peces x 20 gr.","Precio sin impuestos
                            : $0,00","$5.100,00 Precio sin impuestos $4.214,88 $4.845,00 con Transferencia o depósito bancario 💰","Alimento balanceado para peces en forma de escamas que es altamente palatable, tiene máxima digestibilidad, cuenta con todos los nutrientes necesarios y además, cuenta con la ventaja de que no enturbi","","https://lamascoteranoa.com.ar/productos/alimento-shulet-peces-x-20-gr/"
"" ,"Alimento para Peces Shulet x 40gr","Precio sin impuestos
                            : $0,00","$9.200,00 Precio sin impuestos $7.603,31 $8.740,00 con Transferencia o depósito bancario 💰","Una nueva fórmula combina los tradicionales ingredientes junto con nuevas materias primas que potencian el valor nutritivo de este alimento, logrando escamas de alto valor nutricional, gran poder atra","","https://lamascoteranoa.com.ar/productos/alimento-para-peces-shulet-x-40gr/"
"" ,"Almohadón Estampado","Precio sin impuestos
                            : $0,00","$13.800,00 Precio sin impuestos $11.404,96 $13.110,00 con Transferencia o depósito bancario 💰","Almohadón Cuadrado de Lona estampada con base de friselina. Adaptadas para perros y gatos Caracteristicas: Almohadon cuadrado con varios diseños de temporada, Aptos para perros y gatos. Vienen en vari","","https://lamascoteranoa.com.ar/productos/almohadon-estampado/"
"" ,"Almohadón Impermeable","Precio sin impuestos
                            : $0,00","$19.300,00 Precio sin impuestos $15.950,41 $18.335,00 con Transferencia o depósito bancario 💰","Almohadón Cuadrado de Lona estampada con base de friselina. Adaptadas para perros y gatos Caracteristicas: Colchoneta fácil de lavar, quitar pelos y limpiar. Disponible en varios colores T 1 (50x50cm)","","https://lamascoteranoa.com.ar/productos/almohadon-impermeable/"
"" ,"Andis AGC2 Super","Precio sin impuestos
                            : $0,00","$470.000,00 Precio sin impuestos $388.429,75 $446.500,00 con Transferencia o depósito bancario 💰","CONSULTA STOCK AQUI Funcionamiento frio y silencioso, no requiere de ventiladores que soplan pelo. Interruptor de bloqueo, que asegura que no se apague accidentalmente. Cable de alta resistencia, que ","","https://lamascoteranoa.com.ar/productos/andis-agc2-super/"
"" ,"BABS AEROSOL AMBIENTAL X 415 ML.","Precio sin impuestos
                            : $0,00","$13.300,00 Precio sin impuestos $10.991,74 $12.635,00 con Transferencia o depósito bancario 💰","ELIMINA PULGAS, GARRAPATAS Y OTROS PARÁCITOS DEL MEDIO AMBIENTES. Los parásitos, en estado adulto e inmaduro, se encuentran también en las cuchas, dormideros, zócalos, rincones, paredes, alfombras, si","","https://lamascoteranoa.com.ar/productos/babs-aerosol-ambiental-x-415-ml/"
"" ,"BALANCED AD RP X3KG","Precio sin impuestos
                            : $0,00","$19.600,00 Precio sin impuestos $16.198,35 $18.620,00 con Transferencia o depósito bancario 💰","Vitalcan Balanced es ideal para perros adultos de raza pequeña porque su Programa Equilibrio Saludable les proporciona: Modulación de defensas: formulado con vitamina C y nucleótidos de levadura que a","","https://lamascoteranoa.com.ar/productos/balanced-ad-rp-x3kg/"
"" ,"BALANCED LATA CACHORRO X 85GR","Precio sin impuestos
                            : $0,00","$2.700,00 Precio sin impuestos $2.231,40 $2.565,00 con Transferencia o depósito bancario 💰","Balanced Soufflé para cachorros ofrece una alimentación completa con una textura aireada, suave y fácil de digerir, ideal para los primeros meses de vida. ✔️ Con DHA para el desarrollo cerebral y visu","","https://lamascoteranoa.com.ar/productos/balanced-lata-cachorro-x-85gr/"
"" ,"BALANCED LATA CACHORRO x 340gr","Precio sin impuestos
                            : $0,00","$7.600,00 Precio sin impuestos $6.280,99 $7.220,00 con Transferencia o depósito bancario 💰","Balanced Soufflé para cachorros ofrece una alimentación completa con una textura aireada, suave y fácil de digerir, ideal para los primeros meses de vida. ✔️ Con DHA para el desarrollo cerebral y visu","","https://lamascoteranoa.com.ar/productos/balanced-lata-cachorro-x-340gr/"
"" ,"BALANCED LATA GATO ADULTO X 85GR","Precio sin impuestos
                            : $0,00","$2.700,00 Precio sin impuestos $2.231,40 $2.565,00 con Transferencia o depósito bancario 💰","Balanced Soufflé para gatos adultos combina una textura aireada y delicada con ingredientes seleccionados para una experiencia placentera y funcional en cada comida. ✔️ Con prebióticos que favorecen l","","https://lamascoteranoa.com.ar/productos/balanced-lata-gato-adulto-x-85gr/"
"" ,"BALANCED LATA GATO CACHORRO X 340GR","Precio sin impuestos
                            : $0,00","$7.600,00 Precio sin impuestos $6.280,99 $7.220,00 con Transferencia o depósito bancario 💰","Balanced Soufflé para gatos cachorros ofrece una textura aireada y delicada que facilita la transición al alimento sólido, brindando placer y nutrición en cada bocado. ✔️ Con DHA para el desarrollo de","","https://lamascoteranoa.com.ar/productos/balanced-lata-gato-cachorro-x-340gr/"
"" ,"BALANCED LATA GATO CACHORRO X 85GR","Precio sin impuestos
                            : $0,00","$2.700,00 Precio sin impuestos $2.231,40 $2.565,00 con Transferencia o depósito bancario 💰","Balanced Soufflé para gatos cachorros ofrece una textura aireada y delicada que facilita la transición al alimento sólido, brindando placer y nutrición en cada bocado. ✔️ Con DHA para el desarrollo de","","https://lamascoteranoa.com.ar/productos/balanced-lata-gato-cachorro-x-85gr/"
"" ,"BALANCED LATA GATO CASTRADO X 85GR","Precio sin impuestos
                            : $0,00","$2.700,00 Precio sin impuestos $2.231,40 $2.565,00 con Transferencia o depósito bancario 💰","Balanced Soufflé para gatos castrados ofrece una textura suave y aireada con una fórmula pensada para cuidar su salud y mantener el peso ideal, sin resignar sabor. ✔️ Con L-carnitina , que ayuda al me","","https://lamascoteranoa.com.ar/productos/balanced-lata-gato-castrado-x-85gr/"
"" ,"BALANCED LATA GATO SENIOR X 340GR","Precio sin impuestos
                            : $0,00","$7.600,00 Precio sin impuestos $6.280,99 $7.220,00 con Transferencia o depósito bancario 💰","Balanced Soufflé para gatos senior está formulado para acompañar a tu gato en su etapa adulta avanzada, combinando una textura suave y aireada con nutrientes clave para su bienestar. ✔️ Con DHA , que ","","https://lamascoteranoa.com.ar/productos/balanced-lata-gato-senior-x-340gr/"
