categoria,nombre,precio,precio_transferencia,descripcion,variantes,url
"" ,"Eukanuba Senior Raza Mediana x 3 kg.","Precio sin impuestos
                            : $0,00","$30.200,00 Precio sin impuestos $24.958,68 $28.690,00 con Transferencia o depósito bancario 💰","DESCRIPCION : Alimento balanceado seco Para perros senior de razas medianas. Caracteristicas: Eukanuba Senior Medium Breed es un alimento balanceado completo para perros adultos de más de 7 años de ed","","https://lamascoteranoa.com.ar/productos/eukanuba-senior-raza-mediana-x-3-kg/"
"" ,"Eukanuba Senior Raza Pequeña x 3 kg.","Precio sin impuestos
                            : $0,00","$30.700,00 Precio sin impuestos $25.371,90 $29.165,00 con Transferencia o depósito bancario 💰","DESCRIPCION : Alimento balanceado seco Para perros senior de razas pequeñas. Caracteristicas: Eukanuba Senior Small Breed es un alimento balanceado completo para perros adultos de más de 7 años de eda","","https://lamascoteranoa.com.ar/productos/eukanuba-senior-raza-pequena-x-3-kg/"
"" ,"Eukanuba Weight Care Medium x 3 kg.","Precio sin impuestos
                            : $0,00","Precio sin impuestos $0,00 $0,00 con Transferencia o depósito bancario 💰","El Alimento Eukanuba Weight Control Raza Mediana es un alimento balanceado completo para perros adultos de más de 1 año de edad que presentan sobrepeso o tienen menores niveles de actividad física y p","","https://lamascoteranoa.com.ar/productos/eukanuba-weight-care-medium-x-3-kg/"
"" ,"Excellent Cachorro Raza Pequeña x 3 kg.","Precio sin impuestos
                            : $0,00","$23.900,00 Precio sin impuestos $19.752,07 $22.705,00 con Transferencia o depósito bancario 💰","DESCRIPCION Alimento balanceado seco Para perros cachorros de razas pequeñas. Caracteristicas: En su primer año de vida los cachorros necesitan una nutrición óptima para favorecer su desarrollo y crec","","https://lamascoteranoa.com.ar/productos/excellent-cachorro-raza-pequena-x-3-kg/"
"" ,"Excellent Gatito x 1 kg.","Precio sin impuestos
                            : $0,00","$14.500,00 Precio sin impuestos $11.983,47 $13.775,00 con Transferencia o depósito bancario 💰","En su primer año de vida los gatitos necesitan una nutrición óptima para favorecer su desarrollo y crecimiento, hasta llegar a su etapa adulta . PURINA ® Excellent ® Gatitos Pollo y Arroz , ofrece una","","https://lamascoteranoa.com.ar/productos/excellent-gatito-x-1-kg/"
"" ,"Excellent Gato Adulto x 3 kg.","Precio sin impuestos
                            : $0,00","$35.300,00 Precio sin impuestos $29.173,55 $33.535,00 con Transferencia o depósito bancario 💰","EXCELLENT URINARY CAT CON POLLO Y ARROZ X 1KG $0,00 $15.300,00 $14.535,00 con Transferencia o depósito bancario 💰","","https://lamascoteranoa.com.ar/productos/excellent-gato-adulto-x-3-kg/"
"" ,"FAWNA GATO ADULTO STERILIZED X 3KGS","Precio sin impuestos
                            : $0,00","$47.600,00 Precio sin impuestos $39.338,84 $45.220,00 con Transferencia o depósito bancario 💰","Fawna Patagonic Taste Gato Adulto Esterilizado es un alimento seco completo para gatos adultos a partir de los 12 meses. Con un 38% de proteínas del pollo y prebióticos/probióticos naturales, promueve","","https://lamascoteranoa.com.ar/productos/gato-adulto-sterilized-x-3-kg/"
"" ,"FAWNA GATO ADULTO STERILIZED X 7.5 KG","Precio sin impuestos
                            : $0,00","$89.900,00 Precio sin impuestos $74.297,52 $85.405,00 con Transferencia o depósito bancario 💰","Fawna Patagonic Taste Gato Adulto Esterilizado es un alimento seco completo para gatos adultos a partir de los 12 meses. Con un 38% de proteínas del pollo y prebióticos/probióticos naturales, promueve","","https://lamascoteranoa.com.ar/productos/gato-adulto-sterilized-x-7-5-kg/"
"" ,"FAWNA GATO ADULTO X 3KG","Precio sin impuestos
                            : $0,00","$42.400,00 Precio sin impuestos $35.041,32 $40.280,00 con Transferencia o depósito bancario 💰","Fawna Patagonic Taste es un alimento seco completo para gatos adultos que contiene salmón del Pacífico, zapallo y frutos rojos. Con un 35% de proteínas provenientes del salmón y pollo, junto con prebi","","https://lamascoteranoa.com.ar/productos/gato-adulto-x-3kg/"
"" ,"FAWNA GATO ADULTO X 7.5 KG","Precio sin impuestos
                            : $0,00","$81.200,00 Precio sin impuestos $67.107,44 $77.140,00 con Transferencia o depósito bancario 💰","Fawna Patagonic Taste es un alimento seco completo para gatos adultos que contiene salmón del Pacífico, zapallo y frutos rojos. Con un 35% de proteínas provenientes del salmón y pollo, junto con prebi","","https://lamascoteranoa.com.ar/productos/gato-adulto-x-7-5-kg/"
"" ,"FAWNA GATO KITTEN X 1KG","Precio sin impuestos
                            : $0,00","$15.600,00 Precio sin impuestos $12.892,56 $14.820,00 con Transferencia o depósito bancario 💰","Fawna Patagonic Taste Gatito es un alimento seco completo para gatos en su primera etapa de vida hasta los 12 meses. Con un 39% de proteínas provenientes del pollo y prebióticos/probióticos naturales,","","https://lamascoteranoa.com.ar/productos/gato-kitten-x-1kg/"
"" ,"FAWNA GATO KITTEN X 3KG","Precio sin impuestos
                            : $0,00","$44.500,00 Precio sin impuestos $36.776,86 $42.275,00 con Transferencia o depósito bancario 💰","Fawna Patagonic Taste Gatito es un alimento seco completo para gatos en su primera etapa de vida hasta los 12 meses. Con un 39% de proteínas provenientes del pollo y prebióticos/probióticos naturales,","","https://lamascoteranoa.com.ar/productos/gato-kitten-x-3kg/"
"" ,"FAWNA GATO URINARIO X 3KGS","Precio sin impuestos
                            : $0,00","$50.600,00 Precio sin impuestos $41.818,18 $48.070,00 con Transferencia o depósito bancario 💰","Fawna Patagonic Taste Gato Adulto Urinario es un alimento seco completo para gatos adultos con problemas urinarios. Con un 35% de proteínas del pollo y prebióticos/probióticos naturales, promueve una ","","https://lamascoteranoa.com.ar/productos/gato-urinario-x-3-kg/"
"" ,"FAWNA PERRO ADULTO LIGHT X 15 KG","Precio sin impuestos
                            : $0,00","$99.500,00 Precio sin impuestos $82.231,40 $94.525,00 con Transferencia o depósito bancario 💰","Fawna Patagonic Taste Light con salmón es un alimento seco completo para perros adultos de todas las razas, entre 12 meses y 7 años de edad. Destaca por su contenido de salmón del Pacífico, zapallo y ","","https://lamascoteranoa.com.ar/productos/perro-adulto-ligth-x-15-kg/"
"" ,"FAWNA PERRO ADULTO LIGHT X 3KGS","Precio sin impuestos
                            : $0,00","$30.600,00 Precio sin impuestos $25.289,26 $29.070,00 con Transferencia o depósito bancario 💰","Fawna Patagonic Taste Light con salmón es un alimento seco completo para perros adultos de todas las razas, entre 12 meses y 7 años de edad. Destaca por su contenido de salmón del Pacífico, zapallo y ","","https://lamascoteranoa.com.ar/productos/perro-adulto-ligth-x-3-kg/"
"" ,"FAWNA PERRO ADULTO MORDIDA MEDIANA Y GRANDE X 15KGS","Precio sin impuestos
                            : $0,00","$100.000,00 Precio sin impuestos $82.644,63 $95.000,00 con Transferencia o depósito bancario 💰","Fawna Patagonic Taste con salmón en presentación de 3kg. es un alimento seco completo para perros adultos de razas medianas y grandes, entre 12 meses y 7 años de edad. Destaca por su contenido de salm","","https://lamascoteranoa.com.ar/productos/perro-adulto-mordida-mediana-y-grande-x-15kgs/"
"" ,"FAWNA PERRO ADULTO MORDIDA MEDIANA Y GRANDE X 3KGS","Precio sin impuestos
                            : $0,00","$25.600,00 Precio sin impuestos $21.157,02 $24.320,00 con Transferencia o depósito bancario 💰","Fawna Patagonic Taste con salmón en presentación de 3kg. es un alimento seco completo para perros adultos de razas medianas y grandes, entre 12 meses y 7 años de edad. Destaca por su contenido de salm","","https://lamascoteranoa.com.ar/productos/perro-adulto-mordida-mediana-y-grande-x-3kgs/"
"" ,"FAWNA PERRO ADULTO MORDIDA PEQUEÑA X 3KGS","Precio sin impuestos
                            : $0,00","$28.600,00 Precio sin impuestos $23.636,36 $27.170,00 con Transferencia o depósito bancario 💰","Fawna Patagonic Taste con salmón es un alimento seco completo para perros adultos de razas pequeñas, de 12 meses a 7 años. Destaca por su contenido de salmón del Pacífico, zapallo y frutos rojos, con ","","https://lamascoteranoa.com.ar/productos/perro-adulto-mordida-pequena-x-3kgs/"
"" ,"FAWNA PERRO ADULTO MORDIDA PEQUEÑA X 7,5KGS","Precio sin impuestos
                            : $0,00","$56.500,00 Precio sin impuestos $46.694,21 $53.675,00 con Transferencia o depósito bancario 💰","Fawna Patagonic Taste con salmón es un alimento seco completo para perros adultos de razas pequeñas, de 12 meses a 7 años. Destaca por su contenido de salmón del Pacífico, zapallo y frutos rojos, con ","","https://lamascoteranoa.com.ar/productos/perro-adulto-mordida-pequena-x-75kgs/"
"" ,"FAWNA PERRO ADULTO SENIOR X 15 KG","Precio sin impuestos
                            : $0,00","$99.600,00 Precio sin impuestos $82.314,05 $94.620,00 con Transferencia o depósito bancario 💰","Fawna Patagonic Taste Senior con salmón es un alimento seco completo para perros adultos mayores de 7 años. Destaca por su contenido de salmón del Pacífico, zapallo y frutos rojos, con un 31% de prote","","https://lamascoteranoa.com.ar/productos/perro-adulto-senior-x-15-kg/"
"" ,"FAWNA PERRO ADULTO SENIOR X 3KGS","Precio sin impuestos
                            : $0,00","$30.600,00 Precio sin impuestos $25.289,26 $29.070,00 con Transferencia o depósito bancario 💰","Fawna Patagonic Taste Senior con salmón es un alimento seco completo para perros adultos mayores de 7 años. Destaca por su contenido de salmón del Pacífico, zapallo y frutos rojos, con un 31% de prote","","https://lamascoteranoa.com.ar/productos/perro-adulto-senior-x-3-kg/"
"" ,"FAWNA PERRO CACHORRO MORDIDA MEDIANA Y GRANDE X 15KGS","Precio sin impuestos
                            : $0,00","$103.700,00 Precio sin impuestos $85.702,48 $98.515,00 con Transferencia o depósito bancario 💰","Fawna Patagonic Taste con salmón es un alimento seco completo para perros cachorros de razas medianas y grandes de hasta 12 meses de edad. Entre sus ingredientes posee salmón del Pacífico, zapallo y f","","https://lamascoteranoa.com.ar/productos/perro-cahorro-mordida-mediana-y-grande-x-15kgs/"
"" ,"FAWNA PERRO CACHORRO MORDIDA MEDIANA Y GRANDE X 3 KGS","Precio sin impuestos
                            : $0,00","$29.700,00 Precio sin impuestos $24.545,45 $28.215,00 con Transferencia o depósito bancario 💰","Fawna Patagonic Taste con salmón es un alimento seco completo para perros cachorros de razas medianas y grandes de hasta 12 meses de edad. Entre sus ingredientes posee salmón del Pacífico, zapallo y f","","https://lamascoteranoa.com.ar/productos/perro-cahorro-mordida-mediana-y-grande-x-3-kgs/"
"" ,"FAWNA PERRO CACHORRO MORDIDA MEDIANA Y GRANDE X 7,5 KGS","Precio sin impuestos
                            : $0,00","$59.200,00 Precio sin impuestos $48.925,62 $56.240,00 con Transferencia o depósito bancario 💰","Fawna Patagonic Taste con salmón es un alimento seco completo para perros cachorros de razas medianas y grandes de hasta 12 meses de edad. Entre sus ingredientes posee salmón del Pacífico, zapallo y f","","https://lamascoteranoa.com.ar/productos/perro-cahorro-mordida-mediana-y-grande-x-75-kgs/"
"" ,"FAWNA PERRO CACHORRO MORDIDA PEQUEÑA X 3KGS","Precio sin impuestos
                            : $0,00","$29.900,00 Precio sin impuestos $24.710,74 $28.405,00 con Transferencia o depósito bancario 💰","Fawna Patagonic Taste con salmón es un alimento seco completo para cachorros de razas pequeñas hasta los 12 meses. Destaca por su contenido de salmón del Pacífico, zapallo y frutos rojos. Con un 33% d","","https://lamascoteranoa.com.ar/productos/perro-cahorro-mp-x-3kgs/"
"" ,"FAWNA PERRO CACHORRO MORDIDA PEQUEÑA X 7,5 KGS","Precio sin impuestos
                            : $0,00","$58.700,00 Precio sin impuestos $48.512,40 $55.765,00 con Transferencia o depósito bancario 💰","Fawna Patagonic Taste con salmón es un alimento seco completo para cachorros de razas pequeñas hasta los 12 meses. Destaca por su contenido de salmón del Pacífico, zapallo y frutos rojos. Con un 33% d","","https://lamascoteranoa.com.ar/productos/perro-cahorro-mp-x-75-kgs/"
"" ,"FUMIGATOR X 410ML","Precio sin impuestos
                            : $0,00","$11.200,00 Precio sin impuestos $9.256,20 $10.640,00 con Transferencia o depósito bancario 💰","FUMIGATOR® FOGGER es un insecticida larvicida en aerosol con válvula de descarga total para el control de insectos rastreros (cucarachas, hormigas, arañas, insectos de la madera, ácaros, piojos, chinc","","https://lamascoteranoa.com.ar/productos/fumigator-x-410ml/"
"" ,"FUNDA P/ALMOHADON T1","Precio sin impuestos
                            : $0,00","$9.400,00 Precio sin impuestos $7.768,60 $8.930,00 con Transferencia o depósito bancario 💰","Fundas lavables,daptadas para perros y gatos. Tenemos varios modelos y talles Material: POLAR T1 (50cmx50cm)","","https://lamascoteranoa.com.ar/productos/funda-p-almohadon-t1/"
"" ,"FUNDA P/ALMOHADON T2","Precio sin impuestos
                            : $0,00","$13.900,00 Precio sin impuestos $11.487,60 $13.205,00 con Transferencia o depósito bancario 💰","Fundas lavables,daptadas para perros y gatos. Tenemos varios modelos y talles Material: POLAR T2 (55cmx75cm)","","https://lamascoteranoa.com.ar/productos/funda-p-almohadon-t2/"
"" ,"Frisbee de Goma","Precio sin impuestos
                            : $0,00","$6.900,00 Precio sin impuestos $5.702,48 $6.555,00 con Transferencia o depósito bancario 💰","Medidas: 16 cm.","","https://lamascoteranoa.com.ar/productos/frisbee-de-goma/"
"" ,"Front Line Gato","Precio sin impuestos
                            : $0,00","$7.400,00 Precio sin impuestos $6.115,70 $7.030,00 con Transferencia o depósito bancario 💰","","","https://lamascoteranoa.com.ar/productos/front-line-gato/"
"" ,"Front Line Plus hasta 10 kg.","Precio sin impuestos
                            : $0,00","$11.000,00 Precio sin impuestos $9.090,91 $10.450,00 con Transferencia o depósito bancario 💰","DESCRIPCION Garrapaticida-piojicida-pulguicida Para el tratamiento y control de pultas, garrapatas y piojos (adulticida). tambien inhibe el desarrollo de las formas inmaduras (larvas) de las pulgas, l","","https://lamascoteranoa.com.ar/productos/front-line-plus-hasta-10-kg/"
"" ,"Front Line Spot de 10 a 20 kg.","Precio sin impuestos
                            : $0,00","$8.800,00 Precio sin impuestos $7.272,73 $8.360,00 con Transferencia o depósito bancario 💰","Pipeta antiparasitaria para eliminar pulgas, garrapatas y piojos para perros de 10 a 20kg Front Line.","","https://lamascoteranoa.com.ar/productos/front-line-spot-de-10-a-20-kg/"
"" ,"Front Line Spot hasta 10 kg.","Precio sin impuestos
                            : $0,00","$8.100,00 Precio sin impuestos $6.694,21 $7.695,00 con Transferencia o depósito bancario 💰","Pipeta antiparasitaria para eliminar pulgas, garrapatas y piojos para perros de hasta 10kg Front Line.","","https://lamascoteranoa.com.ar/productos/front-line-spot-hasta-10-kg/"
"" ,"Front Line Spot perro 40 a 60kg.","Precio sin impuestos
                            : $0,00","$12.200,00 Precio sin impuestos $10.082,64 $11.590,00 con Transferencia o depósito bancario 💰","Pipeta antiparasitaria para eliminar pulgas, garrapatas y piojos para perros de 40 a 60kg Front Line.","","https://lamascoteranoa.com.ar/productos/front-line-spot-perro-40-a-60kg/"
"" ,"Front Line Spray x 250 ml.","Precio sin impuestos
                            : $0,00","$44.100,00 Precio sin impuestos $36.446,28 $41.895,00 con Transferencia o depósito bancario 💰","DESCRIPCION Antiparasitario externo contra pulgas y garrapatas. Composición: Cada 100 ml. de solución tópica al 0,25% contiene: Fipronil 0,25 g, Excipiente csp: 100 ml. Dosis y administración: Pulveri","","https://lamascoteranoa.com.ar/productos/front-line-spray-x-250-ml/"
"" ,"GALLINA CHILLONA P+","Precio sin impuestos
                            : $0,00","$3.300,00 Precio sin impuestos $2.727,27 $3.135,00 con Transferencia o depósito bancario 💰","Convertí el juego en una fiesta con la gallina chillona, el juguete más divertido para tu mascota. Su sonido gracioso y su diseño colorido atrapan la atención de cualquier perro, invitándolo a correr,","","https://lamascoteranoa.com.ar/productos/gallina-chillona-p-nntby/"
"" ,"GIMNASIO GATO - 2 PISOS","Precio sin impuestos
                            : $0,00","$162.600,00 Precio sin impuestos $134.380,17 $154.470,00 con Transferencia o depósito bancario 💰","Gimnasio para gato 75cm de altura 2 pisos Escalones Escondites con 2 colchones Sector rascador Catre de descanso en la parte superior Realizado en madera de densidad media en 12 mm con encastres muy f","","https://lamascoteranoa.com.ar/productos/gimnasio-gato-2-pisos/"
"" ,"GOLOSINA GRISINES CUERO","Precio sin impuestos
                            : $0,00","$1.600,00 Precio sin impuestos $1.322,31 $1.520,00 con Transferencia o depósito bancario 💰","Golosinas de cuero vacuno con forma de Grisin Para perro pequeños, mediano y grande. Caracteristicas: Además, ayudan a remover las partículas presentes en los dientes del animal que provocan el mal al","","https://lamascoteranoa.com.ar/productos/golosina-grisines-cuero/"
"" ,"Glotoni","Precio sin impuestos
                            : $0,00","$43.400,00 Precio sin impuestos $35.867,77 $41.230,00 con Transferencia o depósito bancario 💰","dispensador de snacks y comida fabricado en caucho natural. ideales para calmar el estrés en esos ratos en los que los dejamos solos, tenemos que realizar alguna actividad en casa sin ellos, o incluso","","https://lamascoteranoa.com.ar/productos/glotoni/"
"" ,"Gooster Adultos Razas Medianas y Grandes x 20 Kg.","Precio sin impuestos
                            : $0,00","$56.600,00 Precio sin impuestos $46.776,86 $53.770,00 con Transferencia o depósito bancario 💰","DESCRIPCION: Alimento balanceado seco Para adultos de razas medianas y grandes, Caracteristicas: A partir del año de edad, tu perro adulto necesita un aporte específico de nutrientes para mantenerse a","","https://lamascoteranoa.com.ar/productos/gooster-adultos-razas-medianas-y-grandes-x-20-kg/"
"" ,"HOMEMADE DELIGHTS CARNE Y VEGETALES PERRO CACHORRO X 340 GR","Precio sin impuestos
                            : $0,00","$5.200,00 Precio sin impuestos $4.297,52 $4.940,00 con Transferencia o depósito bancario 💰","Homemade Delights Beef & Veg para cachorros es un alimento húmedo balanceado con textura tipo paté , ideal hasta los 12 meses de edad. Está elaborado con carne de vaca de campo, zanahoria y vegetales ","","https://lamascoteranoa.com.ar/productos/homemade-delights-carne-y-vegetales-perro-cachorro-x-340-gr/"
"" ,"HOMEMADE DELIGHTS GATITO SALMON LATA X 340GRS.","Precio sin impuestos
                            : $0,00","$5.200,00 Precio sin impuestos $4.297,52 $4.940,00 con Transferencia o depósito bancario 💰","La lata Homemade Delights River Salmon para gatitos está formulada para cubrir las necesidades nutricionales del crecimiento desde los primeros meses de vida. Con salmón como ingrediente principal , a","","https://lamascoteranoa.com.ar/productos/homemade-delights-gatito-salmon-lata-x-340grs/"
"" ,"HOMEMADE DELIGHTS GATO ADULTO SALMON Y ZANAHORIA","Precio sin impuestos
                            : $0,00","$20.300,00 Precio sin impuestos $16.776,86 $19.285,00 con Transferencia o depósito bancario 💰","Es una opción de alimento balanceado, seco o húmedo, para gatos adultos que busca ofrecer una dieta nutritiva y saludable utilizando ingredientes naturales. Ingredientes clave : Salmón y zanahoria. El","","https://lamascoteranoa.com.ar/productos/homemade-delights-gato-adulto-salmon-y-zanahoria-c0jjr/"
"" ,"HOMEMADE DELIGHTS PERRO ADULTO CORDERO Y MANZANA","Precio sin impuestos
                            : $0,00","$18.400,00 Precio sin impuestos $15.206,61 $17.480,00 con Transferencia o depósito bancario 💰","Es un alimento ultra premium natural que combina proteínas de cordero con manzana para una nutrición completa y un sabor atractivo. Características principales Perfil nutricional: Contiene un 28% de p","","https://lamascoteranoa.com.ar/productos/homemade-delights-perro-adulto-cordero-y-manzana-zciqx/"
"" ,"HOMEMADE DELIGHTS PERRO ADULTO LATA X 340GRS.","Precio sin impuestos
                            : $0,00","$5.200,00 Precio sin impuestos $4.297,52 $4.940,00 con Transferencia o depósito bancario 💰","Homemade Delights por 340g es un alimento húmedo y balanceado para perros adultos desde los 12 meses de edad en adelante. Elaborado con ingredientes naturales seleccionados , ofrece una textura suave ","","https://lamascoteranoa.com.ar/productos/homemade-delights-perro-adulto-lata-x-340grs/"
"" ,"HOMEMADE DELIGHTS PERRO ADULTO SALSA X 100GRS.","Precio sin impuestos
                            : $0,00","$2.700,00 Precio sin impuestos $2.231,40 $2.565,00 con Transferencia o depósito bancario 💰","Homemade Delights salsa es un alimento húmedo y balanceado para perros adultos desde los 12 meses de edad en adelante. Elaborado con ingredientes naturales seleccionados , ofrece una textura suave y p","","https://lamascoteranoa.com.ar/productos/homemade-delights-perro-adulto-salsa-x-100grs/"
"" ,"HUESITOS CON CHIPS S/CARNE X 120GRS","Precio sin impuestos
                            : $0,00","$2.800,00 Precio sin impuestos $2.314,05 $2.660,00 con Transferencia o depósito bancario 💰","PROMOCIONES NO ACUMULABLES CON OTROS DESCUENTOS Snacks secos de sabor carne. Para perros de todas las edades y tamaños Caracteristicas: Estos crocantes y exquisitos snacks en forma de huesito contiene","","https://lamascoteranoa.com.ar/productos/huesitos-con-chips-s-carne-x-120grs/"
"" ,"HUESO CON CHIFLE ECONOMICO","Precio sin impuestos
                            : $0,00","$4.600,00 Precio sin impuestos $3.801,65 $4.370,00 con Transferencia o depósito bancario 💰","Brindale muchas horas de diversion aseguradas a tu mimado. Hueso de goma con chicle que lo mantiene atento, le genera curiosidad y reduce su estrés. Elección de colores: Dejanos tus preferencias de co","","https://lamascoteranoa.com.ar/productos/hueso-con-chifle-economico/"
"" ,"HUESO DE GOMA CHICO","Precio sin impuestos
                            : $0,00","$3.500,00 Precio sin impuestos $2.892,56 $3.325,00 con Transferencia o depósito bancario 💰","Glotoni $0,00 $43.400,00 $41.230,00 con Transferencia o depósito bancario 💰","","https://lamascoteranoa.com.ar/productos/hueso-de-goma-chico1/"
"" ,"HUESO RASCA ENCIAS P+","Precio sin impuestos
                            : $0,00","$2.000,00 $1.440,00 Precio sin impuestos $1.190,08 $1.368,00 con Transferencia o depósito bancario 💰","Juguete para mascotas de goma en forma de hueso, con pinchos de goma blandos.","","https://lamascoteranoa.com.ar/productos/hueso-rasca-encias/"
"" ,"Hierba Catnip Deshidratado x 5 grs.","Precio sin impuestos
                            : $0,00","$5.200,00 Precio sin impuestos $4.297,52 $4.940,00 con Transferencia o depósito bancario 💰","La hierba gatera anima a tus gatos a jugar, a moverse y hace que se sientan bien. No es adictiva y puedes estar tranquilo que no le hará ningún daño. De hecho, puedes frotar esta hierba en cualquier j","","https://lamascoteranoa.com.ar/productos/hierba-catnip-deshidratado-x-5-grs/"
"" ,"Hierba para Gatos x 80 grs.","Precio sin impuestos
                            : $0,00","$6.100,00 Precio sin impuestos $5.041,32 $5.795,00 con Transferencia o depósito bancario 💰","Cuando los gatos acicalan su pelaje lamiéndoselo, tragan pelos que luego deben ser eliminados. Para ayudar a un buen tránsito intestinal, ellos comen hierbas que les aportan fibras no digeribles. Las ","","https://lamascoteranoa.com.ar/productos/hierba-para-gatos-x-80-grs/"
"" ,"Higado growis x70gr","Precio sin impuestos
                            : $0,00","$6.000,00 Precio sin impuestos $4.958,68 $5.700,00 con Transferencia o depósito bancario 💰","PROMOCIONES NO ACUMULABLES CON OTROS DESCUENTOS Higado x 70 grs Snack nutritivo Para perros de todas las edades y tamaños Caracteristicas : Los snacks de higado son una excelente fuente de nutrientes,","","https://lamascoteranoa.com.ar/productos/higado-growis-x70gr/"
"" ,"Huellitas saca pelusa x 2 unidades","Precio sin impuestos
                            : $0,00","$15.100,00 Precio sin impuestos $12.479,34 $14.345,00 con Transferencia o depósito bancario 💰","Huellitas de goma saca pelos y pelusas (para eliminar el pelito suelto de tu ropa, tapizados del auto, sillones, etc) ¿Cómo se usa? La huellita podés usarla en: Tu lavarropas: primero cargá la ropa y ","","https://lamascoteranoa.com.ar/productos/huellitas-saca-pelusa-x-2-unidades/"
"" ,"Hueso Mordillo de Goma","Precio sin impuestos
                            : $0,00","$6.600,00 Precio sin impuestos $5.454,55 $6.270,00 con Transferencia o depósito bancario 💰","Material resistente, ideal para que tu mascota gaste energia y se divierta! Hueso Mordillo de Goma Peso: 77 grs Medidas: 9 cm","","https://lamascoteranoa.com.ar/productos/hueso-mordillo-de-goma/"
