categoria,nombre,precio,precio_transferencia,descripcion,variantes,url
"" ,"Pro Plan Adulto Raza Pequeña x 7.5 kg.","Precio sin impuestos
                            : $0,00","$82.500,00 Precio sin impuestos $68.181,82 $78.375,00 con Transferencia o depósito bancario 💰","PROMOCIONES NO ACUMULABLES CON OTROS DESCUENTOS DESCRIPCION : Alimento balanceado seco para perros adultos de razas pequeñas. Caracteristicas: Provee nutrición de avanzada que ayuda a los perros de ra","","https://lamascoteranoa.com.ar/productos/pro-plan-adulto-raza-pequena-x-7-5-kg/"
"" ,"Pro Plan Cachorro Raza Mediana x 15 kg.","Precio sin impuestos
                            : $0,00","$143.500,00 Precio sin impuestos $118.595,04 $136.325,00 con Transferencia o depósito bancario 💰","DESCRIPCION : Alimento balanceado seco para perros cachorros e razas medianas. Caracteristicas: Los cachorros de tallas medias crecen rápidamente y su metabolismo es más acelerado. Requieren de una al","","https://lamascoteranoa.com.ar/productos/pro-plan-cachorro-raza-mediana-x-15-kg/"
"" ,"Pro Plan Cachorro Raza Pequeña x 1 kg.","Precio sin impuestos
                            : $0,00","$17.000,00 Precio sin impuestos $14.049,59 $16.150,00 con Transferencia o depósito bancario 💰","DESCRIPCION : Alimento balanceado seco Para perros cachorros e razas pequeñas. Caracteristicas: Los cachorros de tallas pequeñas crecen rápidamente y su metabolismo es más acelerado. Requieren de una ","","https://lamascoteranoa.com.ar/productos/pro-plan-cachorro-raza-pequena-x-1-kg/"
"" ,"Pro Plan Cachorro Raza Pequeña x 3 kg.","Precio sin impuestos
                            : $0,00","$45.600,00 Precio sin impuestos $37.685,95 $43.320,00 con Transferencia o depósito bancario 💰","DESCRIPCION : Alimento balanceado seco Para perros cachorros e razas pequeñas. Caracteristicas: Los cachorros de tallas pequeñas crecen rápidamente y su metabolismo es más acelerado. Requieren de una ","","https://lamascoteranoa.com.ar/productos/pro-plan-cachorro-raza-pequena-x-3-kg/"
"" ,"Pro Plan Gato Adulto Castrado x 3 kg.","Precio sin impuestos
                            : $0,00","$67.400,00 Precio sin impuestos $55.702,48 $64.030,00 con Transferencia o depósito bancario 💰","Alimento completo y balanceado para gatos adultos castrados o esterilizados. La esterilización y/o castración conduce a cambios que pueden predisponer a un aumento de peso. OptiRenal ® ayuda a mantene","","https://lamascoteranoa.com.ar/productos/pro-plan-gato-adulto-castrado-x-3-kg/"
"" ,"Pro Plan Gato Adulto Castrado x 7.5 kg.","Precio sin impuestos
                            : $0,00","$135.400,00 Precio sin impuestos $111.900,83 $128.630,00 con Transferencia o depósito bancario 💰","Alimento completo y balanceado para gatos adultos castrados o esterilizados. La esterilización y/o castración conduce a cambios que pueden predisponer a un aumento de peso. OptiRenal® ayuda a mantener","","https://lamascoteranoa.com.ar/productos/pro-plan-gato-adulto-castrado-x-7-5-kg/"
"" ,"Pro Plan Gato Adulto Urinario x 3 kg.","Precio sin impuestos
                            : $0,00","$67.300,00 Precio sin impuestos $55.619,83 $63.935,00 con Transferencia o depósito bancario 💰","DESCRIPCION Una alimentación balanceada es esencial para que tu fiel compañero se mantenga sano y fuerte. La dieta de tu gato se reflejará en su pelaje, por lo que es de vital importancia que contenga","","https://lamascoteranoa.com.ar/productos/pro-plan-gato-adulto-urinario-x-3-kg/"
"" ,"Pro Plan Gato Adulto Urinario x 7.5 kg.","Precio sin impuestos
                            : $0,00","$107.400,00 Precio sin impuestos $88.760,33 $102.030,00 con Transferencia o depósito bancario 💰","DESCRIPCION Una alimentación balanceada es esencial para que tu fiel compañero se mantenga sano y fuerte. La dieta de tu gato se reflejará en su pelaje, por lo que es de vital importancia que contenga","","https://lamascoteranoa.com.ar/productos/pro-plan-gato-adulto-urinario-x-7-5-kg/"
"" ,"Pulguicida Garrapaticida en Aerosol Young","Precio sin impuestos
                            : $0,00","$15.900,00 Precio sin impuestos $13.140,50 $15.105,00 con Transferencia o depósito bancario 💰","Práctico aerosol que combate las pulgas y garrapatas e inhibe su reproducción en nuestros perros. Se aplica directamente en el perro y se recomienda su aplicación cada 2 ó 3 semanas.","","https://lamascoteranoa.com.ar/productos/pulguicida-garrapaticida-en-aerosol-young/"
"" ,"Pulmon Aireado growis x50gr","Precio sin impuestos
                            : $0,00","$5.700,00 Precio sin impuestos $4.710,74 $5.415,00 con Transferencia o depósito bancario 💰","PROMOCIONES NO ACUMULABLES CON OTROS DESCUENTOS Pulmon aireado x 50grs Snack nutritivo. Para perros de todas las edades y tamaños Caracteristicas : Los Aireados son snacks de nuestra linea crunch, baj","","https://lamascoteranoa.com.ar/productos/pulmon-aireado-growis-x50gr/"
"" ,"RAMA DE GOMA","Precio sin impuestos
                            : $0,00","$5.000,00 Precio sin impuestos $4.132,23 $4.750,00 con Transferencia o depósito bancario 💰","Juguete de goma resistente en forma de rama de 20cm Colores disponibles: Rosa, fucsia, lila, azul, violeta, naranja, rojo, verde, celeste Podes dejarnos en notas, cualquier información que quieras dar","","https://lamascoteranoa.com.ar/productos/rama-de-goma/"
"" ,"RAMPA PERRO","Precio sin impuestos
                            : $0,00","$86.600,00 Precio sin impuestos $71.570,25 $82.270,00 con Transferencia o depósito bancario 💰","Rampa para Perros De 37 cm x 1 metro. Tiene 8 posiciones.  Se eleva hasta 60 cm Realizada en madera de densidad media en 12 mm Enchapada en melanina blanca.  Excelentes terminaciones Las rampas para p","","https://lamascoteranoa.com.ar/productos/rampa-perro/"
"" ,"RASCADOR PICHI COLGANTE","Precio sin impuestos
                            : $0,00","$11.900,00 Precio sin impuestos $9.834,71 $11.305,00 con Transferencia o depósito bancario 💰","Diseñado para mantener a tu felino entretenido y en forma, este rascador es la solución perfecta para espacios reducidos.","","https://lamascoteranoa.com.ar/productos/rascador-pichi-colgante/"
"" ,"RASCADOR TRIANGULO MUNDO CUCHA","Precio sin impuestos
                            : $0,00","$36.500,00 Precio sin impuestos $30.165,29 $34.675,00 con Transferencia o depósito bancario 💰","Juguete rascador para gatos Ancho 16cm.  Largo 20cm.  Alto 20cm Esfera de 12cm de diámetro con juguete en su interior Realizado en madera de densidad media en 12mm Enchapada en melamina blanca.  Excel","","https://lamascoteranoa.com.ar/productos/rascador-triangulo-mundo-cucha/"
"" ,"RATA DOBLE OREJA","Precio sin impuestos
                            : $0,00","$6.100,00 Precio sin impuestos $5.041,32 $5.795,00 con Transferencia o depósito bancario 💰","Rata Doble Oreja : el juguete perfecto para estimular el instinto cazador de tu gato Esta rata de peluche bicolor tiene una forma redondeada y cuenta con plumas y cintas en la cola que captan la atenc","","https://lamascoteranoa.com.ar/productos/rata-doble-oreja/"
"" ,"RATON MOVIL","Precio sin impuestos
                            : $0,00","$7.400,00 Precio sin impuestos $6.115,70 $7.030,00 con Transferencia o depósito bancario 💰","Se trata de un juguete para tu gato en forma de ratón con un diseño suave y colorido, su tamaño es de aproximadamente 7cm. Simplemente tiras de la cuerda que posee y el roedor comienza a moverse y a v","","https://lamascoteranoa.com.ar/productos/raton-movil/"
"" ,"REFUGIO TORRE","Precio sin impuestos
                            : $0,00","$90.100,00 Precio sin impuestos $74.462,81 $85.595,00 con Transferencia o depósito bancario 💰","Escondite para gato en forma de pentágono De 35 cm cada lado y 50 cm de alto Realizadas en madera de densidad media en 12 mm con encastres muy firmes. Enchapada en melanina blanca.  Excelentes termina","","https://lamascoteranoa.com.ar/productos/refugio-torre/"
"" ,"REPUESTO PASTO GRANDE","Precio sin impuestos
                            : $0,00","$42.500,00 Precio sin impuestos $35.123,97 $40.375,00 con Transferencia o depósito bancario 💰","-ALFOMBRA GRANDE PARA BANDEJA SANITARIA GRANDE (REPUESTO)- * Medidas alfombra: 62 cm de largo x 40 de ancho. * Medidas bandeja: 69 cm de largo x 48 cm de ancho x 3,5 cm de alto. * Es práctica, segura,","","https://lamascoteranoa.com.ar/productos/repuesto-pasto-grande/"
"" ,"RODILLO SACAPELUSA","Precio sin impuestos
                            : $0,00","$3.700,00 Precio sin impuestos $3.057,85 $3.515,00 con Transferencia o depósito bancario 💰","Eliminá pelusas, pelos y suciedad de forma rápida y efectiva con este rodillo sacapelusas con lámina adhesiva . Su diseño práctico y liviano permite usarlo en ropa, sillones, cortinas, mantas y más, s","","https://lamascoteranoa.com.ar/productos/rodillo-sacapelusa/"
"" ,"ROYAL FIT 32 X 7.5KG","Precio sin impuestos
                            : $0,00","$138.200,00 Precio sin impuestos $114.214,88 $131.290,00 con Transferencia o depósito bancario 💰","Alimento para gatos adultos con peso ideal, actividad física moderada y que poseen acceso al exterior. De 1 a 7 años de edad.","","https://lamascoteranoa.com.ar/productos/royal-fit-32-x-7-5kg/"
"" ,"ROYAL GATO EARLY RENAL X1,5KG","Precio sin impuestos
                            : $0,00","$42.500,00 Precio sin impuestos $35.123,97 $40.375,00 con Transferencia o depósito bancario 💰","Royal Canin Early Renal Feline es un alimento seco balanceado para gatos mayores a un año, especialmente formulado para mascotas con problemas renales crónicos. Brinda un refuerzo al sistema renal ya ","","https://lamascoteranoa.com.ar/productos/royal-gato-early-renal-x15kg1/"
"" ,"ROYAL GATOS CASTRADOS-WEIGHT CONTROL X1,5KG","Precio sin impuestos
                            : $0,00","$41.700,00 Precio sin impuestos $34.462,81 $39.615,00 con Transferencia o depósito bancario 💰","Royal Canin gato castrado - weight control es un alimento completo para gatos adultos (machos y/o hembras) desde la esterilización hasta los 7 años de edad con apetito voraz. El mismo previene la apar","","https://lamascoteranoa.com.ar/productos/royal-gatos-castrados-weight-control-x15kg/"
"" ,"ROYAL GATOS CASTRADOS-WEIGHT CONTROL X12KG","Precio sin impuestos
                            : $0,00","$193.300,00 Precio sin impuestos $159.752,07 $183.635,00 con Transferencia o depósito bancario 💰","Royal Canin gato castrado - weight control es un alimento completo para gatos adultos (machos y/o hembras) desde la esterilización hasta los 7 años de edad con apetito voraz. El mismo previene la apar","","https://lamascoteranoa.com.ar/productos/royal-gatos-castrados-weight-control-x12kg/"
"" ,"ROYAL GATOS CASTRADOS-WEIGHT CONTROL X3KG","Precio sin impuestos
                            : $0,00","$78.000,00 Precio sin impuestos $64.462,81 $74.100,00 con Transferencia o depósito bancario 💰","Royal Canin gato castrado - weight control es un alimento completo para gatos adultos (machos y/o hembras) desde la esterilización hasta los 7 años de edad con apetito voraz. El mismo previene la apar","","https://lamascoteranoa.com.ar/productos/royal-gatos-castrados-weight-control-x3kg/"
"" ,"ROYAL GATOS CASTRADOS-WEIGHT CONTROL X7,5KG","Precio sin impuestos
                            : $0,00","$138.100,00 Precio sin impuestos $114.132,23 $131.195,00 con Transferencia o depósito bancario 💰","Royal Canin gato castrado - weight control es un alimento completo para gatos adultos (machos y/o hembras) desde la esterilización hasta los 7 años de edad con apetito voraz. El mismo previene la apar","","https://lamascoteranoa.com.ar/productos/royal-gatos-castrados-weight-control-x75kg/"
"" ,"ROYAL MAXI ADULT X 3KG","Precio sin impuestos
                            : $0,00","$43.200,00 Precio sin impuestos $35.702,48 $41.040,00 con Transferencia o depósito bancario 💰","Alimento completo para perros adultos de talla grande (de 26 a 44 kg). Desde los 15 meses hasta los 5 años de edad.","","https://lamascoteranoa.com.ar/productos/royal-maxi-adult-x-3kg/"
"" ,"ROYAL MAXI PUPPY X 3KG","Precio sin impuestos
                            : $0,00","$48.400,00 Precio sin impuestos $40.000,00 $45.980,00 con Transferencia o depósito bancario 💰","Alimento balanceado completo para caninos cachorros de talla grande (peso adulto entre 26 y 44 kg). De 2 a 15 meses de edad. Royal Canin Maxi Puppy ayuda a promover una óptima seguridad digestiva y un","","https://lamascoteranoa.com.ar/productos/royal-maxi-puppy-x-3kg/"
"" ,"ROYAL MEDIUM ADULT X15KG","Precio sin impuestos
                            : $0,00","$155.800,00 Precio sin impuestos $128.760,33 $148.010,00 con Transferencia o depósito bancario 💰","DESCRIPCION : Alimento balanceado seco Para perros adultos medianos. Caracteristicas: Ayuda a dar soporte a las defensas naturales gracias a un complejo de antioxidantes y a los manano-oligosacáridos.","","https://lamascoteranoa.com.ar/productos/royal-medium-adult-x15kg2/"
"" ,"ROYAL MINI ADULT X7.5KG","Precio sin impuestos
                            : $0,00","$99.900,00 Precio sin impuestos $82.561,98 $94.905,00 con Transferencia o depósito bancario 💰","DESCRIPCION : Alimento balanceado seco para perros adultos. Caracteristicas: Ayuda a mantener un peso saludable en perros de talla pequeña, cubriendo sus elevadas necesidades energéticas, gracias al a","","https://lamascoteranoa.com.ar/productos/royal-mini-adult-x7-5kg/"
"" ,"Rascador Alto con Pelota","Precio sin impuestos
                            : $0,00","$21.000,00 Precio sin impuestos $17.355,37 $19.950,00 con Transferencia o depósito bancario 💰","Rascador para gatos de 53cm de alto con pelota.","","https://lamascoteranoa.com.ar/productos/rascador-alto-con-pelota/"
"" ,"Rascador Ami Toy","Precio sin impuestos
                            : $0,00","$12.600,00 Precio sin impuestos $10.413,22 $11.970,00 con Transferencia o depósito bancario 💰","Ami Toy es un juego interactivo para gatos. Posee dos pelotas en el centro que giran por todo el contorno del juguete. Del lado de abajo es de madera y tiene 4 paños anti desliz para que quede firme y","","https://lamascoteranoa.com.ar/productos/rascador-ami-toy/"
"" ,"Rascador Bermuda","Precio sin impuestos
                            : $0,00","$21.400,00 Precio sin impuestos $17.685,95 $20.330,00 con Transferencia o depósito bancario 💰","Modelo Bermud es ideal para gatos juguetones, dinámicos y muy intensos. Ecologico Reversible Resistente Medidas: Alto: 42,5cm | Ancho: 48cm | Profundidad: 17cm","","https://lamascoteranoa.com.ar/productos/rascador-bermuda/"
"" ,"Rascador Break","Precio sin impuestos
                            : $0,00","$43.300,00 Precio sin impuestos $35.785,12 $41.135,00 con Transferencia o depósito bancario 💰","Esta cara de gato ademas de rascador es un escondite. Tu gatito puede dormir por dentro y salir a rascar por fuera. Es de uso muy duradero, tiene terminaciones en madera y es ecologico.","","https://lamascoteranoa.com.ar/productos/rascador-break/"
"" ,"Rascador Jagger estampado","Precio sin impuestos
                            : $0,00","$21.500,00 Precio sin impuestos $17.768,60 $20.425,00 con Transferencia o depósito bancario 💰","Modelo Jagger estampado: Reversible Resistente Ecologico Medidas: 48cm largo X 20cm ancho X 8cm alto Jagger estampado es un modelo ideal para gatos grande, que suelen acostarse sobre su rascador.","","https://lamascoteranoa.com.ar/productos/rascador-jagger-estampado/"
"" ,"Rascador Nomis","Precio sin impuestos
                            : $0,00","$29.200,00 Precio sin impuestos $24.132,23 $27.740,00 con Transferencia o depósito bancario 💰","Este rascador esconde un secreto en su nombre, ¿adivinaron cual es? Esta compuesto de materiales reciclables y es ideal para gatitos pequeños.","","https://lamascoteranoa.com.ar/productos/rascador-nomis/"
"" ,"Rascador París","Precio sin impuestos
                            : $0,00","$29.200,00 Precio sin impuestos $24.132,23 $27.740,00 con Transferencia o depósito bancario 💰","Rascador para gatos modelo Paris. Rascador de carton corrugado. Este producto es Ecologico, reversible y resistente. Medidas: 40x19x24 Diametro del centro 14cm","","https://lamascoteranoa.com.ar/productos/rascador-paris/"
"" ,"Rascador Simon Estampado","Precio sin impuestos
                            : $0,00","$21.400,00 Precio sin impuestos $17.685,95 $20.330,00 con Transferencia o depósito bancario 💰","Modelo Simon Estampado: Reversible Economico Duradero Ecologico Medidas: 48cm largo X 20cm ancho X 8cm alto Simon ya es un clásico. Ideal para gatos medianos y chicos.","","https://lamascoteranoa.com.ar/productos/rascador-simon-estampado/"
"" ,"Rascador Tiny","Precio sin impuestos
                            : $0,00","$15.800,00 Precio sin impuestos $13.057,85 $15.010,00 con Transferencia o depósito bancario 💰","Modelo Tiny super eficiente para gatos chicos y medianos.","","https://lamascoteranoa.com.ar/productos/rascador-tiny/"
"" ,"Repuesto Rodillo Quitapelos (x 2)","Precio sin impuestos
                            : $0,00","$4.400,00 Precio sin impuestos $3.636,36 $4.180,00 con Transferencia o depósito bancario 💰","Rodillo adhesivo de alta adherencia utilizado para retirar pelaje de superficies.","","https://lamascoteranoa.com.ar/productos/repuesto-rodillo-quitapelos-x-2-unid/"
"" ,"Roll growis x 3ud","Precio sin impuestos
                            : $0,00","$7.400,00 Precio sin impuestos $6.115,70 $7.030,00 con Transferencia o depósito bancario 💰","PROMOCIONES NO ACUMULABLES CON OTROS DESCUENTOS Roll x 3 unidades Dental nutritivo. Para perros de todas las edades y tamaños Caracteristicas : Bocas más sanas junto a nuestro snack dental Roll. ¡Mejo","","https://lamascoteranoa.com.ar/productos/roll-growis-x-3ud/"
"" ,"Royal Canin Boxer Adulto x 12 kg.","Precio sin impuestos
                            : $0,00","$131.500,00 Precio sin impuestos $108.677,69 $124.925,00 con Transferencia o depósito bancario 💰","DESCRIPCION : Alimento balanceado seco Para perros boxers en etapa adulta. Caracteristicas: Ayuda a promover el desarrollo de la masa muscular gracias a un adecuado aporte de proteínas. Esta fórmula t","","https://lamascoteranoa.com.ar/productos/royal-canin-boxer-adulto-x-12-kg/"
"" ,"Royal Canin Boxer Junior x 12 kg.","Precio sin impuestos
                            : $0,00","$145.200,00 Precio sin impuestos $120.000,00 $137.940,00 con Transferencia o depósito bancario 💰","DESCRIPCION : Alimento balanceado seco Para perros boxers en etapa cachorros. Caracteristicas: La etapa de crecimiento es esencial en la vida de su perro: es un momento de grandes cambios, descubrimie","","https://lamascoteranoa.com.ar/productos/royal-canin-boxer-junior-x-12-kg/"
"" ,"Royal Canin Bulldog Francés Adulto x 3 kg.","Precio sin impuestos
                            : $0,00","$53.500,00 Precio sin impuestos $44.214,88 $50.825,00 con Transferencia o depósito bancario 💰","DESCRIPCION : Alimento balanceado seco Para perros bulldog frances en etapa adulta. Caracteristicas: El Bulldog Francés suele tener una musculatura poderosa. Bulldog Francés adulto ayuda a mantener la","","https://lamascoteranoa.com.ar/productos/royal-canin-bulldog-frances-adulto-x-3-kg/"
"" ,"Royal Canin Bulldog Francés Adulto x 7.5 Kg.","Precio sin impuestos
                            : $0,00","$103.600,00 Precio sin impuestos $85.619,83 $98.420,00 con Transferencia o depósito bancario 💰","DESCRIPCION : Alimento balanceado seco Para perros bulldog frances en etapa adulta. Caracteristicas: El Bulldog Francés suele tener una musculatura poderosa. Bulldog Francés adulto ayuda a mantener la","","https://lamascoteranoa.com.ar/productos/royal-canin-bulldog-frances-adulto-x-7-5-kg/"
"" ,"Royal Canin Bulldog Francés Junior x 1 kg.","Precio sin impuestos
                            : $0,00","$19.200,00 Precio sin impuestos $15.867,77 $18.240,00 con Transferencia o depósito bancario 💰","DESCRIPCION : Alimento balanceado seco Para perros bulldog frances en etapa cachorro. Caracteristicas: El Bulldog Francés suele tener una musculatura poderosa. Bulldog Francés adulto ayuda a mantener ","","https://lamascoteranoa.com.ar/productos/royal-canin-bulldog-frances-junior-x-1-kg/"
"" ,"Royal Canin Bulldog Francés Junior x 3 kg.","Precio sin impuestos
                            : $0,00","$58.200,00 Precio sin impuestos $48.099,17 $55.290,00 con Transferencia o depósito bancario 💰","DESCRIPCION : Alimento balanceado seco Para perros bulldog frances en etapa cachorro. Caracteristicas: El Bulldog Francés suele tener una musculatura poderosa. Bulldog Francés adulto ayuda a mantener ","","https://lamascoteranoa.com.ar/productos/royal-canin-bulldog-frances-junior-x-3-kg/"
"" ,"Royal Canin Bulldog Inglés Adulto x 12 Kg.","Precio sin impuestos
                            : $0,00","$131.500,00 Precio sin impuestos $108.677,69 $124.925,00 con Transferencia o depósito bancario 💰","DESCRIPCION : Alimento balanceado seco Para perros bulldog ingles en etapa adulta. Caracteristicas: Esta fórmula contribuye a reducir la fermentación intestinal que puede  causar trastornos digestivos","","https://lamascoteranoa.com.ar/productos/royal-canin-bulldog-ingles-adulto-x-12-kg/"
"" ,"Royal Canin Caniche Adulto x 1 kg.","Precio sin impuestos
                            : $0,00","$18.300,00 Precio sin impuestos $15.123,97 $17.385,00 con Transferencia o depósito bancario 💰","DESCRIPCION : Alimento balanceado seco Para perros de adulto de raza Caniche. Caracteristicas: Esta fórmula contiene nutrientes que contribuyen a la salud del pelaje lanoso del Caniche. Enriquecido co","","https://lamascoteranoa.com.ar/productos/royal-canin-caniche-adulto-x-1-kg/"
"" ,"Royal Canin Caniche Adulto x 3 kg.","Precio sin impuestos
                            : $0,00","$53.500,00 Precio sin impuestos $44.214,88 $50.825,00 con Transferencia o depósito bancario 💰","DESCRIPCION : Alimento balanceado seco Para perros adultos de razas Caniches. Caracteristicas: El tamaño y la textura de las croquetas de las fórmulas Caniche están especialmente desarrolladas para fa","","https://lamascoteranoa.com.ar/productos/royal-canin-caniche-adulto-x-3-kg/"
"" ,"Royal Canin Caniche Adulto x 7.5 kg.","Precio sin impuestos
                            : $0,00","$103.600,00 Precio sin impuestos $85.619,83 $98.420,00 con Transferencia o depósito bancario 💰","DESCRIPCION : Alimento balanceado seco Para perros de adulto de raza Caniche. Caracteristicas: Esta fórmula contiene nutrientes que contribuyen a la salud del pelaje lanoso del Caniche. Enriquecido co","","https://lamascoteranoa.com.ar/productos/royal-canin-caniche-adulto-x-7-5-kg/"
"" ,"Royal Canin Caniche Junior x 1 kg.","Precio sin impuestos
                            : $0,00","$19.200,00 Precio sin impuestos $15.867,77 $18.240,00 con Transferencia o depósito bancario 💰","Alimento para perros cachorros de raza Caniche – Hasta los 10 meses de edad.","","https://lamascoteranoa.com.ar/productos/royal-canin-caniche-junior-x-1-kg/"
"" ,"Royal Canin Caniche Junior x 3 kg.","Precio sin impuestos
                            : $0,00","$58.200,00 Precio sin impuestos $48.099,17 $55.290,00 con Transferencia o depósito bancario 💰","DESCRIPCION : Alimento balanceado seco Para perros de cachorros de raza Caniche. Caracteristicas: Alimento para perros cachorros de raza Caniche, de 2 a 10 meses de edad. Royal Canin Caniche Junior pr","","https://lamascoteranoa.com.ar/productos/royal-canin-caniche-junior-x-3-kg/"
"" ,"Royal Canin Chihuahua Adulto x 1 kg.","Precio sin impuestos
                            : $0,00","$19.400,00 Precio sin impuestos $16.033,06 $18.430,00 con Transferencia o depósito bancario 💰","DESCRIPCION : Alimento balanceado seco Para perros chihuahua en etapa adulta. Caracteristicas: El Chihuahua suele tener un apetito caprichoso. Por ello se recomienda una alimentación de gran palatabil","","https://lamascoteranoa.com.ar/productos/royal-canin-chihuahua-adulto-x-1-kg/"
"" ,"Royal Canin Dachshund Adulto x 3 kg.","Precio sin impuestos
                            : $0,00","$53.500,00 Precio sin impuestos $44.214,88 $50.825,00 con Transferencia o depósito bancario 💰","DESCRIPCION : Alimento balanceado seco Para perros de adultos de razas dachshund. Caracteristicas: Dachshund Adulto contribuye en la salud de huesos y las articulaciones del Dachshund gracias al conte","","https://lamascoteranoa.com.ar/productos/royal-canin-dachshund-adulto-x-3-kg/"
"" ,"Royal Canin Gato Calm x 2 kg.","Precio sin impuestos
                            : $0,00","$62.700,00 Precio sin impuestos $51.818,18 $59.565,00 con Transferencia o depósito bancario 💰","Alimento adecuado para gatos que sufren situaciones estresantes en momentos determinados de su vida: llegada de un nuevo animal a casa, viajes en coche, mudanzas, fiestas de fin de año y trastornos de","","https://lamascoteranoa.com.ar/productos/royal-canin-gato-calm-x-2-kg/"
"" ,"Royal Canin Gato Gastrointestinal x 2 kg.","Precio sin impuestos
                            : $0,00","$57.400,00 Precio sin impuestos $47.438,02 $54.530,00 con Transferencia o depósito bancario 💰","Alimento completo para gatos, formulado para ayudar en el manejo de los trastornos agudos de absorción intestinal y promover la restauración nutricional y convalecencia. Ingredientes altamente digesti","","https://lamascoteranoa.com.ar/productos/royal-canin-gato-gastrointestinal-x-2-kg/"
