categoria,nombre,precio,precio_transferencia,descripcion,variantes,url
"" ,"OLD PRINCE GATOS ADULTOS (URINARY CARE) 7,5 KG","Precio sin impuestos
                            : $0,00","$66.900,00 Precio sin impuestos $55.289,26 $63.555,00 con Transferencia o depósito bancario 💰","Old Prince Equilibrium Urinary Care es un alimento para gatos adultos con tendencia a contraer afecciones en su sistema urinario. Promueve el consumo de agua y regula el pH de la orina, reduciendo el ","","https://lamascoteranoa.com.ar/productos/old-prince-gatos-adultos-urinary-care-75-kg/"
"" ,"OLD PRINCE GATOS ADULTOS 7,5 KG","Precio sin impuestos
                            : $0,00","$58.300,00 Precio sin impuestos $48.181,82 $55.385,00 con Transferencia o depósito bancario 💰","Old Prince Equilibrium Complete Care es un alimento balanceado para gatos adultos de 1 a 7 años de edad. Colabora con el control del peso y la prevención de formación de bolas de pelo. Su aporte de ac","","https://lamascoteranoa.com.ar/productos/old-prince-gatos-adultos-75-kg/"
"" ,"OLD PRINCE PREMIUM ADULTO X 3KG","Precio sin impuestos
                            : $0,00","$10.900,00 Precio sin impuestos $9.008,26 $10.355,00 con Transferencia o depósito bancario 💰","Alimento seco para perros adultos de cualquier talla desde los 12 meses hasta los 7 años de edad. Fortalece la Estructura Corporal: Formulado con calcio, fosforo y acidos grasos esenciales (EPA) que f","","https://lamascoteranoa.com.ar/productos/old-prince-premium-adulto-x-3kg/"
"" ,"OLD PRINCE PREMIUM CACHORRO X 15KGS","Precio sin impuestos
                            : $0,00","$53.000,00 Precio sin impuestos $43.801,65 $50.350,00 con Transferencia o depósito bancario 💰","Old Prince Premium Cachorros sabor Pollo y Carne es un alimento balanceado para perros cachorros. Su fórmula contiene un 26% de proteína, además de ofrecer los nutrientes necesarios para el crecimient","","https://lamascoteranoa.com.ar/productos/old-prince-premium-cachorro-x-15kgs/"
"" ,"OLD PRINCE PREMIUM CACHORRO X 3KGS","Precio sin impuestos
                            : $0,00","$11.700,00 Precio sin impuestos $9.669,42 $11.115,00 con Transferencia o depósito bancario 💰","Old Prince Premium Cachorros sabor Pollo y Carne es un alimento balanceado para perros cachorros. Su fórmula contiene un 26% de proteína, además de ofrecer los nutrientes necesarios para el crecimient","","https://lamascoteranoa.com.ar/productos/old-prince-premium-cachorro-x-3kgs/"
"" ,"OLD PRINCE PREMIUM CORDERO Y ARROZ X 15KGS","Precio sin impuestos
                            : $0,00","$74.100,00 Precio sin impuestos $61.239,67 $70.395,00 con Transferencia o depósito bancario 💰","Alimento seco para perros adultos de cualquier talla desde los 12 meses hasta los 7 años de edad. Fortalece la Estructura Corporal: Formulado con calcio, fosforo y acidos grasos esenciales (EPA) que f","","https://lamascoteranoa.com.ar/productos/old-prince-premium-cordero-y-arroz-x-15kgs/"
"" ,"OLD PRINCE PREMIUM CORDERO Y ARROZ X 3 KG","Precio sin impuestos
                            : $0,00","$16.400,00 Precio sin impuestos $13.553,72 $15.580,00 con Transferencia o depósito bancario 💰","Alimento seco para perros adultos de cualquier talla desde los 12 meses hasta los 7 años de edad. Fortalece la Estructura Corporal: Formulado con calcio, fosforo y acidos grasos esenciales (EPA) que f","","https://lamascoteranoa.com.ar/productos/old-prince-premium-cordero-y-arroz-x-3-kg/"
"" ,"OLD PRINCE PREMIUM GATITO X 3 KG","Precio sin impuestos
                            : $0,00","$21.500,00 Precio sin impuestos $17.768,60 $20.425,00 con Transferencia o depósito bancario 💰","Alimento balanceado para gatos Kitten de 3 a 12 Meses de edad. Colabora con el control del peso y la prevención de formación de bolas de pelo. Su aporte de aceites esenciales Omega 3 y 6 fortalece el ","","https://lamascoteranoa.com.ar/productos/old-prince-premium-gatito-x-3-kg/"
"" ,"OLD PRINCE PREMIUM GATITO X 7.5 KG","Precio sin impuestos
                            : $0,00","$42.800,00 Precio sin impuestos $35.371,90 $40.660,00 con Transferencia o depósito bancario 💰","Alimento balanceado para gatos Kitten de 3 a 12 Meses de edad. Colabora con el control del peso y la prevención de formación de bolas de pelo. Su aporte de aceites esenciales Omega 3 y 6 fortalece el ","","https://lamascoteranoa.com.ar/productos/old-prince-premium-gatito-x-7-5-kg/"
"" ,"OLD PRINCE PREMIUM GATO AD X 3 KG","Precio sin impuestos
                            : $0,00","$19.600,00 Precio sin impuestos $16.198,35 $18.620,00 con Transferencia o depósito bancario 💰","Alimento balanceado para gatos adultos de 1 a 7 años de edad. Colabora con el control del peso y la prevención de formación de bolas de pelo. Su aporte de aceites esenciales Omega 3 y 6 fortalece el s","","https://lamascoteranoa.com.ar/productos/old-prince-premium-gato-ad-x-3-kg/"
"" ,"Old Prince Cordero y Arroz Cachorro x 15 kg.","Precio sin impuestos
                            : $0,00","$93.300,00 Precio sin impuestos $77.107,44 $88.635,00 con Transferencia o depósito bancario 💰","DESCRIPCION: Alimento balanceado seco Para perros cachorros razas. Ingredientes : Harina de cordero, arroz integral, arveja, gluten de maíz, germen de maíz desgrasado, grasa animal (pollo), aceite de ","","https://lamascoteranoa.com.ar/productos/old-prince-cordero-y-arroz-cachorro-x-15-kg/"
"" ,"Old Prince Equilibrium Adulto Raza Mediana y Grande x 7.5 kg.","Precio sin impuestos
                            : $0,00","$35.600,00 Precio sin impuestos $29.421,49 $33.820,00 con Transferencia o depósito bancario 💰","DESCRIPCION: Alimento balanceado seco Para perros adultos de razas medianas y grandes. Ingredientes : Harina de pollo, arroz, gluten de maíz, germen de maíz desgrasado, aceite de pollo , aceite de pes","","https://lamascoteranoa.com.ar/productos/old-prince-equilibrium-adulto-raza-mediana-y-grande-x-7-5-kg/"
"" ,"Old Prince Equilibrium Adulto Raza Pequeña x 15 kg.","Precio sin impuestos
                            : $0,00","$68.900,00 Precio sin impuestos $56.942,15 $65.455,00 con Transferencia o depósito bancario 💰","DESCRIPCION: Alimento balanceado seco Para perros adultos de razas pequeñas. Ingredientes : Harina de pollo, arroz, gluten de maíz, germen de maíz desgrasado, aceite de pollo , aceite de pescado (fuen","","https://lamascoteranoa.com.ar/productos/old-prince-equilibrium-adulto-raza-pequena-x-15-kg/"
"" ,"Old Prince Equilibrium Cachorro Raza Pequeña x 3 kg.","Precio sin impuestos
                            : $0,00","$17.800,00 Precio sin impuestos $14.710,74 $16.910,00 con Transferencia o depósito bancario 💰","DESCRIPCION: Alimento balanceado seco Para perros cachorros de razas pequeñas. Ingredientes : Harina de pollo, arroz, gluten de maíz, germen de maíz desgrasado, aceite de pollo , aceite de pescado (fu","","https://lamascoteranoa.com.ar/productos/old-prince-equilibrium-cachorro-raza-pequena-x-3-kg/"
"" ,"Old Prince Equilibrium Cachorro Raza Pequeña x 7.5 kg.","Precio sin impuestos
                            : $0,00","$39.200,00 Precio sin impuestos $32.396,69 $37.240,00 con Transferencia o depósito bancario 💰","DESCRIPCION: Alimento balanceado seco Para perros cachorros de razas pequeñas. Ingredientes : Harina de pollo, arroz, gluten de maíz, germen de maíz desgrasado, aceite de pollo , aceite de pescado (fu","","https://lamascoteranoa.com.ar/productos/old-prince-equilibrium-cachorro-raza-pequena-x-7-5-kg/"
"" ,"Old Prince Kitten Cordero y Arroz x 3 kg.","Precio sin impuestos
                            : $0,00","$36.800,00 Precio sin impuestos $30.413,22 $34.960,00 con Transferencia o depósito bancario 💰","OLD PRINCE GATOS ADULTOS (URINARY CARE) 7,5 KG $0,00 $66.900,00 $63.555,00 con Transferencia o depósito bancario 💰","","https://lamascoteranoa.com.ar/productos/old-prince-kitten-cordero-y-arroz-x-3-kg/"
"" ,"Old Prince Noveles Cerdo y Legumbres x 15 kg.","Precio sin impuestos
                            : $0,00","$74.800,00 Precio sin impuestos $61.818,18 $71.060,00 con Transferencia o depósito bancario 💰","DESCRIPCION: Alimento balanceado seco Para perros adultos de todas las razas. Ingredientes : Carne de cerdo en polvo, garbanzo, lenteja, arveja, arroz integral, gluten de maíz, germen de maíz desgrasa","","https://lamascoteranoa.com.ar/productos/old-prince-noveles-cerdo-y-legumbres-x-15-kg/"
"" ,"Old Prince Noveles Cerdo y Legumbres x 3 kg.","Precio sin impuestos
                            : $0,00","$17.200,00 Precio sin impuestos $14.214,88 $16.340,00 con Transferencia o depósito bancario 💰","DESCRIPCION: Alimento balanceado seco Para perros adultos de todas las razas. Ingredientes : Carne de cerdo en polvo, garbanzo, lenteja, arveja, arroz integral, gluten de maíz, germen de maíz desgrasa","","https://lamascoteranoa.com.ar/productos/old-prince-noveles-cerdo-y-legumbres-x-3-kg/"
"" ,"Old Prince Noveles Cordero y Arroz Adulto Raza Pequeña x 3 kg.","Precio sin impuestos
                            : $0,00","$21.600,00 Precio sin impuestos $17.851,24 $20.520,00 con Transferencia o depósito bancario 💰","DESCRIPCION: Alimento balanceado seco Para perros adultos razas pequeñas. Ingredientes : Harina de cordero, arroz integral, arveja, gluten de maíz, germen de maíz desgrasado, grasa animal (pollo), ace","","https://lamascoteranoa.com.ar/productos/old-prince-noveles-cordero-y-arroz-adulto-raza-pequena-x-3-kg/"
"" ,"Optimum Cachorro Raza Pequeña x 15 kg.","Precio sin impuestos
                            : $0,00","$72.300,00 Precio sin impuestos $59.752,07 $68.685,00 con Transferencia o depósito bancario 💰","DESCRIPCION: Alimento balanceado seco Para perros cachorros razas pequeñas hasta los 9 meses. Caracteristicas: Los cachorros crecen rápidamente, por lo que necesitan una dieta diferente para su desarr","","https://lamascoteranoa.com.ar/productos/optimum-cachorro-raza-pequena-x-15-kg/"
"" ,"Optimum Cachorro Raza Pequeña x 3 kg.","Precio sin impuestos
                            : $0,00","$19.800,00 Precio sin impuestos $16.363,64 $18.810,00 con Transferencia o depósito bancario 💰","DESCRIPCION: Alimento balanceado seco Para perros cachorros razas pequeñas hasta los 9 meses. Caracteristicas: Los cachorros crecen rápidamente, por lo que necesitan una dieta diferente para su desarr","","https://lamascoteranoa.com.ar/productos/optimum-cachorro-raza-pequena-x-3-kg/"
"" ,"Optimum Gatito x 1 kg.","Precio sin impuestos
                            : $0,00","$12.200,00 Precio sin impuestos $10.082,64 $11.590,00 con Transferencia o depósito bancario 💰","Salsa Optimum Gatos Castrados $0,00 $1.900,00 $1.805,00 con Transferencia o depósito bancario 💰","","https://lamascoteranoa.com.ar/productos/optimum-gatito-x-1-kg/"
"" ,"Optimum Gato Castrado x 1 kg.","Precio sin impuestos
                            : $0,00","$11.600,00 Precio sin impuestos $9.586,78 $11.020,00 con Transferencia o depósito bancario 💰","Optimum Gato Castrado x 3 kg. $0,00 $29.800,00 $28.310,00 con Transferencia o depósito bancario 💰","","https://lamascoteranoa.com.ar/productos/optimum-gato-castrado-x-1-kg/"
"" ,"Optimum Gato Castrado x 3 kg.","Precio sin impuestos
                            : $0,00","$29.800,00 Precio sin impuestos $24.628,10 $28.310,00 con Transferencia o depósito bancario 💰","Optimum Gatito x 1 kg. $0,00 $12.200,00 $11.590,00 con Transferencia o depósito bancario 💰","","https://lamascoteranoa.com.ar/productos/optimum-gato-castrado-x-3-kg/"
"" ,"Oreja Growis","Precio sin impuestos
                            : $0,00","$2.000,00 Precio sin impuestos $1.652,89 $1.900,00 con Transferencia o depósito bancario 💰","PROMOCIONES NO ACUMULABLES CON OTROS DESCUENTOS Oreja natural x 1 unidad Para perros de todas las edades y tamaños Caracteristicas :  Las Orejas Growis son naturales, libres de químicos y conservantes","","https://lamascoteranoa.com.ar/productos/oreja-growis/"
"" ,"Otomicine Plus Gotas","Precio sin impuestos
                            : $0,00","$17.400,00 Precio sin impuestos $14.380,17 $16.530,00 con Transferencia o depósito bancario 💰","Indicaciones Otitis externas agudas y crónicas. Tratamiento tópico de alteraciones superficiales del conducto auditivo externo, producidas por: Atopías, hipersensibilidad alimentaría, hipersensibilida","","https://lamascoteranoa.com.ar/productos/otomicine-plus-gotas/"
"" ,"PALA RECOLECTORA PLEGABLE","Precio sin impuestos
                            : $0,00","$16.100,00 Precio sin impuestos $13.305,79 $15.295,00 con Transferencia o depósito bancario 💰","Una solución higiénica y práctica para los paseos. Este recogedor de desechos plegable para perros permite recolectar fácilmente los residuos sin contacto directo. Gracias a su sistema de pinza con re","","https://lamascoteranoa.com.ar/productos/pala-recolectora-plegable/"
"" ,"PALITOS DE CARNE X 80 GR","Precio sin impuestos
                            : $0,00","$2.100,00 Precio sin impuestos $1.735,54 $1.995,00 con Transferencia o depósito bancario 💰","PROMOCIONES NO ACUMULABLES CON OTROS DESCUENTOS","","https://lamascoteranoa.com.ar/productos/palitos-de-carne-x-80-gr/"
"" ,"PALITOS DE POLLOX 80 GR","Precio sin impuestos
                            : $0,00","$2.100,00 Precio sin impuestos $1.735,54 $1.995,00 con Transferencia o depósito bancario 💰","PROMOCIONES NO ACUMULABLES CON OTROS DESCUENTOS","","https://lamascoteranoa.com.ar/productos/palitos-de-pollox-80-gr/"
"" ,"PALTA CATNIP","Precio sin impuestos
                            : $0,00","$6.100,00 Precio sin impuestos $5.041,32 $5.795,00 con Transferencia o depósito bancario 💰","Catnip para tu gato un juguete con el que jugará por horas , incluye adhesivo para fijarlo en superficies Reduce el estres de tu gatito o gatita con el catnip en forma de palta Medidas aproximadas: 6x","","https://lamascoteranoa.com.ar/productos/palta-catnip/"
"" ,"PEDIGREE HIGH PROTEIN X 21 KGS","Precio sin impuestos
                            : $0,00","Precio sin impuestos $0,00 $0,00 con Transferencia o depósito bancario 💰","Salsa Pedigree Cachorro $0,00 $1.600,00 $1.520,00 con Transferencia o depósito bancario 💰","","https://lamascoteranoa.com.ar/productos/pedigree-high-protein-x-21-kgs/"
"" ,"PEINE TODO METAL","Precio sin impuestos
                            : $0,00","$6.900,00 Precio sin impuestos $5.702,48 $6.555,00 con Transferencia o depósito bancario 💰","DESCRIPCIÓN: Peine de acero inoxidable para gatos y perros. Características: Este peine de acero inoxidable es duradero y resistente a la corrosión. Su diseño previene la electricidad estática, brinda","","https://lamascoteranoa.com.ar/productos/peine-todo-metal/"
"" ,"PELOTA 3 MODOS P+","Precio sin impuestos
                            : $0,00","$17.600,00 Precio sin impuestos $14.545,45 $16.720,00 con Transferencia o depósito bancario 💰","¿Tu michi se aburre fácil? Este juguete interactivo es ideal para que se entretenga mientras vos hacés otras cosas. Tiene una bolita que gira y rueda sola y viene con una soga resistente que tu gato v","","https://lamascoteranoa.com.ar/productos/pelota-3-modos-p-6g99z/"
"" ,"PELOTA CON PINCHOS C/ LUZ","Precio sin impuestos
                            : $0,00","$2.500,00 Precio sin impuestos $2.066,12 $2.375,00 con Transferencia o depósito bancario 💰","Estimulá el juego y la actividad física de tu mascota con esta pelota con pinchos con luz LED incorporada . Su superficie con picos suaves masajea las encías y contribuye a la higiene dental, mientras","","https://lamascoteranoa.com.ar/productos/pelota-con-pinchos-c-luz/"
"" ,"PELOTA DE GOMA CHICA DOBLE CON SOGA","Precio sin impuestos
                            : $0,00","$7.900,00 Precio sin impuestos $6.528,93 $7.505,00 con Transferencia o depósito bancario 💰","Juguete de soga alpina de 8mm de 55cm de largo con pelotas de goma en sus extremos, ideal para jugar al tire y afloje con tu mascota para estimular su mente y fortalecer el vinculo entre ambos. Podes ","","https://lamascoteranoa.com.ar/productos/pelota-de-goma-chica-doble-con-soga/"
"" ,"PELOTA DE TENIS POR 3","Precio sin impuestos
                            : $0,00","$8.600,00 Precio sin impuestos $7.107,44 $8.170,00 con Transferencia o depósito bancario 💰","Pelota Mediana con Soga Alpina largo de 70 cm. $0,00 $8.100,00 $7.695,00 con Transferencia o depósito bancario 💰","","https://lamascoteranoa.com.ar/productos/pelota-de-tenis-por-3/"
"" ,"PELOTA INTELIGENTE P+","Precio sin impuestos
                            : $0,00","$7.300,00 Precio sin impuestos $6.033,06 $6.935,00 con Transferencia o depósito bancario 💰","Mantené a tu mascota activa y entretenida con esta pelota interactiva eléctrica. Su tamaño compacto y liviano la hace ideal para gatitos curiosos y pequeñas mascotas, estimulando el juego y el ejercic","","https://lamascoteranoa.com.ar/productos/pelota-inteligente-p-saxzc/"
"" ,"PELOTA PORTA COMIDA","Precio sin impuestos
                            : $0,00","$7.600,00 Precio sin impuestos $6.280,99 $7.220,00 con Transferencia o depósito bancario 💰","Entretenimiento y estimulación en un solo juguete. Esta pelota porta comida con sonido está diseñada para mantener a tu perro activo, curioso y motivado. Cuenta con textura elevada , orificios para co","","https://lamascoteranoa.com.ar/productos/pelota-porta-comida/"
"" ,"PELOTA PUAS DE GOMA SOGA ALPINA LARGO 30 CM","Precio sin impuestos
                            : $0,00","$3.900,00 Precio sin impuestos $3.223,14 $3.705,00 con Transferencia o depósito bancario 💰","Juguete Mordillo de Goma $0,00 $8.400,00 $7.980,00 con Transferencia o depósito bancario 💰","","https://lamascoteranoa.com.ar/productos/pelota-puas-de-goma-soga-alpina-largo-30-cm/"
"" ,"PELOTA Y SOGA PASTEL","Precio sin impuestos
                            : $0,00","$5.800,00 Precio sin impuestos $4.793,39 $5.510,00 con Transferencia o depósito bancario 💰","Esta pelota es estupenda para los ratos de juego con su perro. Puede jugar al siempre efectivo juego de lanzar y recoger que gusta tanto a nuestras mascotas. Está fabricada en una goma termoplástica (","","https://lamascoteranoa.com.ar/productos/pelota-y-soga-pastel/"
"" ,"PELUCHE CANICHE P+","Precio sin impuestos
                            : $0,00","$11.000,00 Precio sin impuestos $9.090,91 $10.450,00 con Transferencia o depósito bancario 💰","Este juguete con forma de perrito es perfecto para mimar o jugar. Está hecho con tela resistente de textura tejida y patas con felpa suave, ideal para que tu mascota lo muerda, lo lleve y lo abrace si","","https://lamascoteranoa.com.ar/productos/peluche-caniche-p-9rlz1/"
"" ,"PELUCHE COMIDA CON CHIFLE","Precio sin impuestos
                            : $0,00","$4.900,00 Precio sin impuestos $4.049,59 $4.655,00 con Transferencia o depósito bancario 💰","Peluche con chifle. Especificar en comentarios la forma elegida.","","https://lamascoteranoa.com.ar/productos/peluche-comida-con-chifle/"
"" ,"PELUCHE CON HIERBA","Precio sin impuestos
                            : $0,00","$6.600,00 Precio sin impuestos $5.454,55 $6.270,00 con Transferencia o depósito bancario 💰","Este jueguete le aportará horas de entretenimiento a tu compañero gatuno, posee una esfera de hierva gatera que ayuda a que tu mascota se relaje y divierta todos los días, es inofensiva para los gatos","","https://lamascoteranoa.com.ar/productos/peluche-con-hierba/"
"" ,"PELUCHE MONO P+","Precio sin impuestos
                            : $0,00","$11.400,00 Precio sin impuestos $9.421,49 $10.830,00 con Transferencia o depósito bancario 💰","Juguete de peluche con asa de cuerda trenzada para Perros Más juego, menos aburrimiento. Este juguete con asa de cuerda trenzada está pensado para tirar, morder y traer , ayudando a tu perro a liberar","","https://lamascoteranoa.com.ar/productos/peluche-mono-p-kmy62/"
"" ,"PELUCHE PATO P+","Precio sin impuestos
                            : $0,00","$9.300,00 Precio sin impuestos $7.685,95 $8.835,00 con Transferencia o depósito bancario 💰","Juguete de tela con forma de pato, ideal para lanzar, traer y morder . Mantiene a tu perro entretenido y activo , ayudando a liberar energía de manera segura Ligero y fácil de agarrar: cuello y alas f","","https://lamascoteranoa.com.ar/productos/peluche-pato-p-6p6hh/"
"" ,"PELUCHE PERRO P+","Precio sin impuestos
                            : $0,00","$11.000,00 Precio sin impuestos $9.090,91 $10.450,00 con Transferencia o depósito bancario 💰","Este juguete con forma de perrito es perfecto para mimar o jugar. Está hecho con tela resistente de textura tejida y patas con felpa suave, ideal para que tu mascota lo muerda, lo lleve y lo abrace si","","https://lamascoteranoa.com.ar/productos/peluche-perro-p-gvcuq/"
"" ,"PERFUME PICHI X130CC","Precio sin impuestos
                            : $0,00","$10.175,00 Precio sin impuestos $8.409,09 $9.666,25 con Transferencia o depósito bancario 💰","Este exquisito perfume ha sido diseñado específicamente para mascotas, dejando una fragancia fresca y agradable en su pelaje.","","https://lamascoteranoa.com.ar/productos/perfume-pichi-x130cc/"
"" ,"PERFUME QUINTA PATA X1LTR","Precio sin impuestos
                            : $0,00","$36.900,00 Precio sin impuestos $30.495,87 $35.055,00 con Transferencia o depósito bancario 💰","Este exquisito perfume ha sido diseñado específicamente para mascotas, dejando una fragancia fresca y agradable en su pelaje.","","https://lamascoteranoa.com.ar/productos/perfume-quinta-pata-x1ltr/"
"" ,"PESCADO LOCO P+","Precio sin impuestos
                            : $0,00","$15.000,00 Precio sin impuestos $12.396,69 $14.250,00 con Transferencia o depósito bancario 💰","Dale a tu minino horas de diversión con este pez de felpa que se agita y ondula al contacto , imitando el movimiento real de un pescado. Estimula su instinto cazador, reduce el aburrimiento y promueve","","https://lamascoteranoa.com.ar/productos/pescado-loco-p-ghl66/"
"" ,"PIEDRAS PIPI CAT BIANCO LAVANDA X 1.8 KG","Precio sin impuestos
                            : $0,00","$4.400,00 Precio sin impuestos $3.636,36 $4.180,00 con Transferencia o depósito bancario 💰","Pipicat Bianco Lavanda son piedras blancas 100% naturales con un delicado aroma a lavanda , que aporta una sensación de frescura extra en cada uso. Su granulado blanco no forma terrones y no se adhier","","https://lamascoteranoa.com.ar/productos/piedras-pipi-cat-bianco-lavanda-x-1-8-kg/"
"" ,"PIEDRAS PIPI CAT BIANCO SENSITIVE X 1.8 KG","Precio sin impuestos
                            : $0,00","$3.500,00 Precio sin impuestos $2.892,56 $3.325,00 con Transferencia o depósito bancario 💰","Pipicat Bianco Sensitive está diseñada especialmente para gatos con necesidades particulares: gatitos, adultos mayores o con sobrepeso . Su fórmula delicada cuida sus patas, brindando una experiencia ","","https://lamascoteranoa.com.ar/productos/piedras-pipi-cat-bianco-sensitive-x-1-8-kg/"
"" ,"PIEDRAS PIPI CAT ULTRA CONTROL X 4KG","Precio sin impuestos
                            : $0,00","$8.100,00 Precio sin impuestos $6.694,21 $7.695,00 con Transferencia o depósito bancario 💰","Pipicat Ultra Control es una arena sanitaria ultra aglomerante con carbón activado , ideal para quienes buscan el máximo control de olores y una limpieza práctica. Su fórmula forma terrón firme y fáci","","https://lamascoteranoa.com.ar/productos/piedras-pipi-cat-ultra-control-x-4kg/"
"" ,"PIEDRAS SANITARIAS NIC x 20 kg","Precio sin impuestos
                            : $0,00","$18.400,00 Precio sin impuestos $15.206,61 $17.480,00 con Transferencia o depósito bancario 💰","Piedras sanitarias blancas x 20kg Antiadherentes, sin polvillo, facilita la limpieza de desechos líquidos y sólidos 100% natural","","https://lamascoteranoa.com.ar/productos/piedras-sanitarias-nic-x-20-kg/"
"" ,"PIEDRAS SANITARIAS THE BEST LAVANDA","Precio sin impuestos
                            : $0,00","$3.500,00 Precio sin impuestos $2.892,56 $3.325,00 con Transferencia o depósito bancario 💰","The Best Lavanda es un granulado higiénico 100% natural con alto poder absorbente y perfume a lavanda , ideal para mantener la bandeja de tu gato limpia y sin olores. ✔️ Elimina olores y mantiene el a","","https://lamascoteranoa.com.ar/productos/piedras-sanitarias-the-best-lavanda/"
"" ,"PORTA BOLSA + ROLLO","Precio sin impuestos
                            : $0,00","$4.300,00 Precio sin impuestos $3.553,72 $4.085,00 con Transferencia o depósito bancario 💰","-Junte las necesidades que las mascotas dejan en la vereda -Largo del rollo: 10cm -Medidas aproximadas de las bolsitas: 32 x 25 cm. -Colores disponibles: rosa, verde y azul","","https://lamascoteranoa.com.ar/productos/porta-bolsa-rollo/"
"" ,"PREMIUM CACHORRO X 20KG","Precio sin impuestos
                            : $0,00","$51.100,00 Precio sin impuestos $42.231,40 $48.545,00 con Transferencia o depósito bancario 💰","Los cachorros tienen un metabolismo más acelerado y crecen rápido, por lo que precisan dietas con niveles altos de energía y proteínas. Además, resulta de gran importancia el aporte de ingredient","","https://lamascoteranoa.com.ar/productos/premium-cachorro-x-20kg/"
"" ,"PREMIUM GATO URINARY X 7,5","Precio sin impuestos
                            : $0,00","$35.100,00 Precio sin impuestos $29.008,26 $33.345,00 con Transferencia o depósito bancario 💰","Vitalcan Premium Urinary es una alimento para gatos adultos con tendencia a contraer afecciones en su sistema urinario. Promueve el consumo de agua y regula el pH de la orina, reduciendo el riesgo de ","","https://lamascoteranoa.com.ar/productos/premium-gato-urinary-x-75/"
